Symbol,Name,Last Sale,Net Change,% Change,Market Cap,Country,Volume,Sector,Price x Volume,Smooth Test,Peers
MGLN,Magellan Health Inc. Common Stock,93.64,0.4,0,Large,United States,324479,Health Care,30384213.56,TRUE,$UNH $ANTM $HUM $SPY
SLAB,Silicon Laboratories Inc. Common Stock,147.92,6.85,0.05,Large,United States,205166,Technology,30348154.72,TRUE,$NVDA $INTC $AVGO $SPY
AMRN,Amarin Corporation plc,6.48,0.27,0.04,Large,Ireland,4672105,Health Care,30275240.4,FALSE,$ALKS $AMRN $PRTA $SPY
FOLD,Amicus Therapeutics Inc. Common Stock,10.06,0.18,0.02,Large,United States,3002083,Health Care,30200954.98,TRUE,$950160.KQ $ABBV $AMGN $SPY
MC,Moelis & Company Class A Common Stock,56.15,1.27,0.02,Large,,536731,Finance,30137445.65,TRUE,$MS $SCHW $GS $SPY
DOCN,DigitalOcean Holdings Inc. Common Stock,43.8,1.67,0.04,Large,,687211,Technology,30099841.8,TRUE,$SNOW $TWLO $OKTA $SPY
RETA,Reata Pharmaceuticals Inc. Class A Common Stock,100.62,0.92,0.01,Large,United States,298673,Health Care,30052477.26,TRUE,$JNJ $PFE $MRK $SPY
SEAS,SeaWorld Entertainment Inc. Common Stock,51.06,1.39,0.03,Large,United States,587816,Consumer Services,30013884.96,TRUE,$MTN $PLNT $SIX $SPY
BHVN,Biohaven Pharmaceutical Holding Company Ltd. Common Shares,68.26,-0.09,0,Large,United States,439290,Health Care,29985935.4,TRUE,$950160.KQ $ABBV $AMGN $SPY
TKR,Timken Company (The) Common Stock,82.16,0.99,0.01,Large,United States,364968,Capital Goods,29985770.88,TRUE,$ITW $PH $SWK $SPY
MYGN,Myriad Genetics Inc. Common Stock,31.21,0.76,0.03,Large,United States,959756,Health Care,29953984.76,TRUE,$950160.KQ $ABBV $AMGN $SPY
VSAT,ViaSat Inc. Common Stock,50.34,2.27,0.05,Large,United States,593514,Technology,29877494.76,TRUE,$CSCO $MSI $ANET $SPY
IGT,International Game Technology Ordinary Shares,16.85,0.8,0.05,Large,United States,1770896,Consumer Services,29839597.6,TRUE,$IGT $WMH.L $GYS.L $SPY
NEO,NeoGenomics Inc. Common Stock,48.53,0.3,0.01,Large,United States,614368,Health Care,29815279.04,TRUE,$TMO $ILMN $A $SPY
BCO,Brinks Company (The) Common Stock,79.24,0.01,0,Large,United States,375125,Transportation,29724905,TRUE,$ADT $BCO $CXW $SPY
HGV,Hilton Grand Vacations Inc. Common Stock ,38,0.51,0.01,Large,,782048,Consumer Services,29717824,TRUE,$ABNB $MAR $HLT $SPY
FAF,First American Corporation (New) Common Stock,57.44,0.79,0.01,Large,United States,515868,Finance,29631457.92,TRUE,$PGR $TRV $ALL $SPY
TMX,Terminix Global Holdings Inc. Common Stock,48.61,0.94,0.02,Large,,609139,Consumer Services,29610246.79,TRUE,$SCI $TMX $FTDR $SPY
RXN,Rexnord Corporation Common Stock,47.92,0.83,0.02,Large,United States,615653,Technology,29502091.76,TRUE,$ITW $PH $SWK $SPY
CASY,Casey's General Stores Inc. Common Stock,216.7,0.51,0,Large,United States,134446,Consumer Durables,29134448.2,TRUE,$KR $ACI $CASY $SPY
TRTN,Triton International Limited Common Shares,55.64,0.65,0.01,Large,,523124,Technology,29106619.36,TRUE,$TRTN $TGH $SPY
FOXF,Fox Factory Holding Corp. Common Stock,130.63,3.57,0.03,Large,United States,222206,Consumer Non-Durables,29026769.78,TRUE,$1316.HK $QS $BWA $SPY
PEB,Pebblebrook Hotel Trust Common Shares of Beneficial Interest,24.36,0.07,0,Large,United States,1190679,Consumer Services,29004940.44,TRUE,$MGP $HST $PK $SPY
AZEK,The AZEK Company Inc. Class A Common Stock,43.29,1.24,0.03,Large,United States,669865,Consumer Non-Durables,28998455.85,TRUE,$CARR $MAS $FBHS $SPY
ANF,Abercrombie & Fitch Company Common Stock,34.46,0.15,0,Large,United States,838622,Consumer Services,28898914.12,TRUE,$TJX $ROST $BURL $SPY
CNO,CNO Financial Group Inc. Common Stock,24.89,0.6,0.02,Large,United States,1158900,Finance,28845021,TRUE,$MET $PRU $AFL $SPY
WK,Workiva Inc. Class A Common Stock,92.29,4.03,0.05,Large,United States,311399,Technology,28739013.71,TRUE,$ADBE $CRM $INTU $SPY
FIZZ,National Beverage Corp. Common Stock,48.04,-0.87,-0.02,Large,United States,598127,Consumer Non-Durables,28734021.08,TRUE,$KO $PEP $KDP $SPY
CLH,Clean Harbors Inc. Common Stock,86.15,2.09,0.02,Large,United States,332591,Basic Industries,28652714.65,TRUE,$WM $RSG $ROL $SPY
MXL,MaxLinear Inc. Common Stock,36.55,2.47,0.07,Large,United States,781419,Technology,28560864.45,TRUE,$NVDA $INTC $AVGO $SPY
EGP,EastGroup Properties Inc. Common Stock,147.8,4.52,0.03,Large,United States,192375,Consumer Services,28433025,TRUE,$PLD $DRE $COLD $SPY
REXR,Rexford Industrial Realty Inc. Common Stock,51.83,1.43,0.03,Large,United States,546069,Consumer Services,28302756.27,TRUE,$PLD $DRE $COLD $SPY
ENR,Energizer Holdings Inc. Common Stock,48.37,0.91,0.02,Large,United States,583665,Miscellaneous,28231876.05,TRUE,$PG $CL $KMB $SPY
CC,Chemours Company (The) Common Stock,28.2,0.29,0.01,Large,United States,1000257,Basic Industries,28207247.4,TRUE,$EMN $HUN $CC $SPY
ADNT,Adient plc Ordinary Shares ,43.1,-1.1,-0.02,Large,,653633,Capital Goods,28171582.3,TRUE,$APTV $ADNT $SPY
UFPI,UFP Industries Inc. Common Stock,77.33,1.49,0.02,Large,United States,364172,Basic Industries,28161420.76,TRUE,$CARR $MAS $FBHS $SPY
MIME,Mimecast Limited Ordinary Shares,40.85,0.64,0.02,Large,United Kingdom,688653,Technology,28131475.05,TRUE,$TEAM $AVV.L $SGE.L $SPY
KRTX,Karuna Therapeutics Inc. Common Stock,122.93,2.7,0.02,Large,United States,228420,Health Care,28079670.6,FALSE,$950160.KQ $ABBV $AMGN $SPY
TRNO,Terreno Realty Corporation Common Stock,59.21,1.44,0.02,Large,United States,474231,Finance,28079217.51,TRUE,$PLD $DRE $COLD $SPY
MSM,MSC Industrial Direct Company Inc. Common Stock,91.29,1.1,0.01,Large,United States,306746,Capital Goods,28002842.34,TRUE,$FAST $URI $GWW $SPY
HHC,Howard Hughes Corporation (The) Common Stock,97.33,2.2,0.02,Large,United States,287622,Consumer Services,27994249.26,TRUE,$HHC $FOR $STRS $SPY
SBGI,Sinclair Broadcast Group Inc. Class A Common Stock,29.93,0.67,0.02,Large,United States,930992,Consumer Services,27864590.56,TRUE,$VIAC $FOXA $DISCA $SPY
EGHT,8x8 Inc Common Stock,32.92,0.48,0.01,Large,United States,845858,Technology,27845645.36,TRUE,$ADBE $CRM $INTU $SPY
GO,Grocery Outlet Holding Corp. Common Stock,36.8,-0.09,0,Large,United States,756461,Consumer Services,27837764.8,TRUE,$KR $ACI $CASY $SPY
CHK,Chesapeake Energy Corporation Common Stock,44.93,1.54,0.04,Large,United States,619045,Energy,27813691.85,FALSE,$COP $EOG $PXD $SPY
SRC,Spirit Realty Capital Inc. Common Stock,43.45,0.95,0.02,Large,United States,638259,Consumer Services,27732353.55,TRUE,$SPG $O $REG $SPY
TENB,Tenable Holdings Inc. Common Stock,37.46,1.28,0.04,Large,United States,738623,Technology,27668817.58,TRUE,$MSFT $ORCL $NOW $SPY
ALSN,Allison Transmission Holdings Inc. Common Stock,40.89,0.06,0,Large,United States,676093,Capital Goods,27645442.77,TRUE,$CAT $CMI $PCAR $SPY
LHCG,LHC Group Common Stock,192.65,1.44,0.01,Large,United States,143460,Health Care,27637569,TRUE,$CVS $CI $LH $SPY
DSEY,Diversey Holdings Ltd. Ordinary Shares,14.77,0.06,0,Large,United States,1862135,Consumer Durables,27503733.95,TRUE,$SHW $ECL $DD $SPY
NEP,NextEra Energy Partners LP Common Units representing limited partner interests,72.67,-0.21,0,Large,United States,378401,Public Utilities,27498400.67,TRUE,$BEPC $NEP $NOVA $SPY
SGMS,Scientific Games Corp Common Stock,40.09,1.57,0.04,Large,United States,685236,Technology,27471111.24,TRUE,$LVS $DKNG $MGM $SPY
TMHC,Taylor Morrison Home Corporation Common Stock,31.67,0.86,0.03,Large,United States,866927,Capital Goods,27455578.09,TRUE,$DHI $LEN $NVR $SPY
IBRX,ImmunityBio Inc. Common Stock,22.4,-1.34,-0.06,Large,United States,1223357,Health Care,27403196.8,TRUE,$950160.KQ $ABBV $AMGN $SPY
YSG,Yatsen Holding Limited American Depositary Shares each representing four Class A ordinary shares,12.69,0.34,0.03,Large,China,2154289,Consumer Non-Durables,27337927.41,TRUE,$300957.SZ $1044.HK $300146.SZ $SPY
LOPE,Grand Canyon Education Inc. Common Stock,110.28,3.18,0.03,Large,United States,247667,Consumer Services,27312716.76,TRUE,$CHGG $BFAM $LOPE $SPY
CDK,CDK Global Inc. Common Stock,54.16,0.1,0,Large,United States,503008,Miscellaneous,27242913.28,TRUE,$ADBE $CRM $INTU $SPY
PNFP,Pinnacle Financial Partners Inc. Common Stock,90.37,1.71,0.02,Large,United States,301351,Finance,27233089.87,TRUE,$TFC $PNC $FRC $SPY
AQUA,Evoqua Water Technologies Corp. Common Stock,27.28,0.98,0.04,Large,United States,997131,Technology,27201733.68,TRUE,$ITW $PH $SWK $SPY
MED,MEDIFAST INC Common Stock,222.3,10.48,0.05,Large,United States,122132,Consumer Non-Durables,27149943.6,TRUE,$EL $COTY $NUS $SPY
VIAV,Viavi Solutions Inc. Common Stock,16.02,0.32,0.02,Large,United States,1691702,Technology,27101066.04,TRUE,$CSCO $MSI $ANET $SPY
MAN,ManpowerGroup Common Stock,101.29,2.39,0.02,Large,United States,266985,Technology,27042910.65,TRUE,$RHI $UPWK $MAN $SPY
ADC,Agree Realty Corporation Common Stock,68.09,0.78,0.01,Large,United States,396826,Consumer Services,27019882.34,TRUE,$SPG $O $REG $SPY
AXNX,Axonics Modulation Technologies Inc. Common Stock,58.61,-1.28,-0.02,Large,United States,460961,Health Care,27016924.21,TRUE,$ABT $DHR $SYK $SPY
INGR,Ingredion Incorporated Common Stock,90.21,0.29,0,Large,United States,298771,Consumer Non-Durables,26952131.91,TRUE,$ADM $DAR $BG $SPY
OMI,Owens & Minor Inc. Common Stock,37.97,0.38,0.01,Large,United States,708732,Health Care,26910554.04,TRUE,$MCK $ABC $CAH $SPY
AMCX,AMC Networks Inc. Class A Common Stock,53.56,0.4,0.01,Large,United States,500423,Consumer Services,26802655.88,TRUE,$VIAC $FOXA $DISCA $SPY
ELY,Callaway Golf Company Common Stock,27.15,0.4,0.02,Large,United States,986724,Consumer Non-Durables,26789556.6,TRUE,$PTON $HAS $PII $SPY
WFG,West Fraser Timber Co. Ltd Common stock,73.94,1.9,0.03,Large,,362049,Basic Industries,26769903.06,TRUE,$WFG.TO $OSB.TO $SJ.TO $SPY
KEX,Kirby Corporation Common Stock,60.23,-0.05,0,Large,United States,443355,Consumer Services,26703271.65,TRUE,$KEX $MATX $CKH $SPY
SHC,Sotera Health Company Common Stock,25.03,0.07,0,Large,United States,1066017,Health Care,26682405.51,TRUE,$TMO $ILMN $A $SPY
LFUS,Littelfuse Inc. Common Stock,267.4,2.96,0.01,Large,United States,99733,Consumer Durables,26668604.2,TRUE,$APH $GLW $DLB $SPY
JBGS,JBG SMITH Properties Common Shares ,32.45,0.66,0.02,Large,United States,821750,Consumer Services,26665787.5,TRUE,$ARE $BXP $VNO $SPY
VC,Visteon Corporation Common Stock,125.67,3.72,0.03,Large,United States,211901,Capital Goods,26629598.67,TRUE,$1316.HK $QS $BWA $SPY
LSTR,Landstar System Inc. Common Stock,167.7,2.64,0.02,Large,United States,158601,Transportation,26597387.7,TRUE,$UBER $ODFL $LYFT $SPY
TCF,TCF Financial Corporation Common Stock,47.27,0.81,0.02,Large,United States,562487,Finance,26588760.49,TRUE,$TFC $PNC $FRC $SPY
TNL,Travel   Leisure Co. Common  Stock,62.5,1.34,0.02,Large,United States,425390,Consumer Services,26586875,TRUE,$ABNB $MAR $HLT $SPY
PTCT,PTC Therapeutics Inc. Common Stock,49.19,1.84,0.04,Large,United States,537748,Health Care,26451824.12,TRUE,$950160.KQ $ABBV $AMGN $SPY
LOB,Live Oak Bancshares Inc. Common Stock,68.24,-0.25,0,Large,United States,387317,Finance,26430512.08,TRUE,$TFC $PNC $FRC $SPY
FR,First Industrial Realty Trust Inc. Common Stock,47.21,1.42,0.03,Large,United States,558815,Consumer Services,26381656.15,TRUE,$PLD $DRE $COLD $SPY
OGE,OGE Energy Corp Common Stock,32.61,0.25,0.01,Large,United States,807211,Public Utilities,26323150.71,TRUE,$NEE $DUK $SO $SPY
ASH,Ashland Global Holdings Inc. Common Stock,90.36,1.59,0.02,Large,United States,291175,Consumer Durables,26310573,TRUE,$SHW $ECL $DD $SPY
TROX,Tronox Holdings plc Ordinary Shares (UK),19.32,1.02,0.06,Large,United States,1359569,Basic Industries,26266873.08,TRUE,$DOW $WLK $OLN $SPY
ALGT,Allegiant Travel Company Common Stock,244.75,0.69,0,Large,United States,107311,Transportation,26264367.25,TRUE,$LUV $DAL $UAL $SPY
GLOB,Globant S.A. Common Shares,210.07,2.46,0.01,Large,,124855,Technology,26228289.85,TRUE,$GLOB $S30.PA $SWP.PA $SPY
NUS,Nu Skin Enterprises Inc. Common Stock,52.79,-0.1,0,Large,United States,496513,Health Care,26210921.27,TRUE,$EL $COTY $NUS $SPY
TTEK,Tetra Tech Inc. Common Stock,136.94,1.22,0.01,Large,United States,190852,Consumer Services,26135272.88,TRUE,$WM $RSG $ROL $SPY
EB,Eventbrite Inc. Class A Common Stock,23.15,0.99,0.04,Large,United States,1128245,Technology,26118871.75,TRUE,$GOOGL $FB $SNAP $SPY
ESI,Element Solutions Inc. Common Stock,18.81,0.52,0.03,Large,United States,1387351,Basic Industries,26096072.31,TRUE,$SHW $ECL $DD $SPY
SITC,SITE Centers Corp. Common Stock,13.8,0.24,0.02,Large,United States,1888855,Consumer Services,26066199,TRUE,$SPG $O $REG $SPY
IDA,IDACORP Inc. Common Stock,100.26,0.29,0,Large,United States,259492,Public Utilities,26016667.92,TRUE,$NEE $DUK $SO $SPY
WBS,Webster Financial Corporation Common Stock,56.21,1.1,0.02,Large,United States,461228,Finance,25925625.88,TRUE,$TFC $PNC $FRC $SPY
CIG,Comp En De Mn Cemig ADS American Depositary Shares,2.17,-0.1,-0.04,Large,Brazil,11945758,Public Utilities,25922294.86,TRUE,$ELET6.SA $CPFE3.SA $EQTL3.SA $SPY
COHU,Cohu Inc. Common Stock,46,4.16,0.1,Large,United States,562570,Capital Goods,25878220,TRUE,$AMAT $LRCX $KLAC $SPY
UNIT,Uniti Group Inc. Common Stock,11.29,0.26,0.02,Large,United States,2291039,Consumer Services,25865830.31,TRUE,$AMT $CCI $EQIX $SPY
CDE,Coeur Mining Inc. Common Stock,9.38,0.35,0.04,Large,United States,2751311,Basic Industries,25807297.18,TRUE,$NEM $RGLD $CDE $SPY
MEDP,Medpace Holdings Inc. Common Stock,169.66,5.61,0.03,Large,United States,151863,Health Care,25765076.58,TRUE,$TMO $ILMN $A $SPY
HRC,Hill-Rom Holdings Inc Common Stock,110.6,0.12,0,Large,United States,232198,Health Care,25681098.8,TRUE,$ABT $DHR $SYK $SPY
LEG,Leggett & Platt Incorporated Common Stock,46.45,0.8,0.02,Large,United States,552505,Consumer Durables,25663857.25,TRUE,$MHK $TPX $LEG $SPY
WCC,WESCO International Inc. Common Stock,87.04,0.51,0.01,Large,United States,294785,Consumer Non-Durables,25658086.4,TRUE,$FAST $URI $GWW $SPY
ADT,ADT Inc. Common Stock,8.46,0.02,0,Large,United States,3019655,Consumer Services,25546281.3,FALSE,$ADT $BCO $CXW $SPY
MDRX,Allscripts Healthcare Solutions Inc. Common Stock,15.35,0.33,0.02,Large,United States,1661515,Technology,25495947.68,TRUE,$VEEV $TDOC $CERN $SPY
UMPQ,Umpqua Holdings Corporation Common Stock,17.63,0.08,0,Large,United States,1443088,Finance,25441641.44,TRUE,$TFC $PNC $FRC $SPY
EAF,GrafTech International Ltd. Common Stock,12.51,0.28,0.02,Large,United States,2024171,Energy,25322379.21,TRUE,$EMR $3665.TW $ROK $SPY
MORN,Morningstar Inc. Common Stock,233.02,7.98,0.04,Large,United States,108557,Finance,25295952.14,TRUE,$SPGI $CME $ICE $SPY
PB,Prosperity Bancshares Inc. Common Stock,76.2,1.31,0.02,Large,United States,331525,Finance,25262205,TRUE,$TFC $PNC $FRC $SPY
MLCO,Melco Resorts & Entertainment Limited American Depositary Shares,20.28,0.37,0.02,Large,Hong Kong,1244803,Consumer Services,25244604.84,TRUE,$950190.KQ $27.HK $880.HK $SPY
ONTO,Onto Innovation Inc. Common Stock,69.92,4.21,0.06,Large,United States,360874,Capital Goods,25232310.08,TRUE,$AMAT $LRCX $KLAC $SPY
EYE,National Vision Holdings Inc. Common Stock,45.18,1.35,0.03,Large,United States,556823,Health Care,25157263.14,TRUE,$TSCO $ULTA $FIVE $SPY
FTDR,frontdoor inc. Common Stock,55.2,1.45,0.03,Large,United States,455097,Finance,25121354.4,TRUE,$SCI $TMX $FTDR $SPY
RRR,Red Rock Resorts Inc. Class A Common Stock,33.34,0.75,0.02,Large,United States,752821,Consumer Services,25099052.14,TRUE,$LVS $DKNG $MGM $SPY
BPMC,Blueprint Medicines Corporation Common Stock,97.95,0.72,0.01,Large,United States,254794,Health Care,24957072.3,TRUE,$950160.KQ $ABBV $AMGN $SPY
LECO,Lincoln Electric Holdings Inc. Common Shares,123.71,0.77,0.01,Large,United States,201177,Technology,24887606.67,TRUE,$ITW $PH $SWK $SPY
POSH,Poshmark Inc. Class A Common Stock,43.45,2.85,0.07,Large,United States,571139,Consumer Services,24815989.55,TRUE,$AMZN $BKNG $DASH $SPY
APLS,Apellis Pharmaceuticals Inc. Common Stock,43.3,0.39,0.01,Large,United States,571376,Health Care,24740580.8,TRUE,$950160.KQ $ABBV $AMGN $SPY
DCT,Duck Creek Technologies Inc. Common Stock,44.96,-0.18,0,Large,United States,547741,Technology,24626435.36,TRUE,$ADBE $CRM $INTU $SPY
ISBC,Investors Bancorp Inc. Common Stock,14.63,-0.06,0,Large,United States,1679488,Finance,24570909.44,TRUE,$TFC $PNC $FRC $SPY
NAVI,Navient Corporation Common Stock,14.34,0.03,0,Large,United States,1713074,Finance,24565481.16,TRUE,$AXP $COF $DFS $SPY
FNB,F.N.B. Corporation Common Stock,12.74,0.04,0,Large,United States,1927573,Finance,24557280.02,TRUE,$TFC $PNC $FRC $SPY
EME,EMCOR Group Inc. Common Stock,113.66,1.5,0.01,Large,United States,215777,Capital Goods,24525213.82,TRUE,$PWR $ACM $MTZ $SPY
CERT,Certara Inc. Common Stock,27.45,0.15,0.01,Large,United States,892450,Technology,24497752.5,TRUE,$VEEV $TDOC $CERN $SPY
TDC,Teradata Corporation Common Stock,38.93,0.39,0.01,Large,United States,625671,Technology,24357372.03,TRUE,$MSFT $ORCL $NOW $SPY
THS,Treehouse Foods Inc. Common Stock,53.5,1.26,0.02,Large,United States,455129,Consumer Non-Durables,24349401.5,TRUE,$MDLZ $KHC $GIS $SPY
TX,Ternium S.A. Ternium S.A. American Depositary Shares (each representing ten shares USD1.00 par value),39.07,0.23,0.01,Large,Luxembourg,621274,Basic Industries,24273175.18,TRUE,$MT.AS $TX $APAM.AS $SPY
OLK,Olink Holding AB (publ) American Depositary Shares,37.2,1.2,0.03,Large,Sweden,652332,Capital Goods,24266750.4,TRUE,$SPY $DIA $IWM $QQQ
INSM,Insmed Inc. Common Stock,35.44,1.38,0.04,Large,United States,684326,Health Care,24252513.44,TRUE,$950160.KQ $ABBV $AMGN $SPY
VMI,Valmont Industries Inc. Common Stock,241.69,4.02,0.02,Large,United States,100345,Capital Goods,24252383.05,TRUE,$PWR $ACM $MTZ $SPY
EPAY,Bottomline Technologies Inc. Common Stock,46.12,0.87,0.02,Large,United States,525782,Technology,24249065.84,TRUE,$ADBE $CRM $INTU $SPY
RCII,Rent-A-Center Inc. Common Stock,58.98,1.32,0.02,Large,United States,407088,Technology,24010050.24,TRUE,$BBY $GME $RCII $SPY
CPA,Copa Holdings S.A. Copa Holdings S.A. Class A Common Stock,80.92,0.13,0,Large,Panama,296223,Transportation,23970365.16,TRUE,$PFAVH.BC $CPA $SPY
THRM,Gentherm Inc Common Stock,77.2,3.09,0.04,Large,United States,310478,Capital Goods,23968901.6,TRUE,$1316.HK $QS $BWA $SPY
FLS,Flowserve Corporation Common Stock,39.46,0.65,0.02,Large,United States,605913,Capital Goods,23909326.98,TRUE,$ITW $PH $SWK $SPY
NHI,National Health Investors Inc. Common Stock,74.85,2.57,0.04,Large,United States,319242,Consumer Services,23895263.7,TRUE,$WELL $VTR $PEAK $SPY
SMTC,Semtech Corporation Common Stock,71.46,2.46,0.04,Large,United States,334072,Technology,23872785.12,TRUE,$NVDA $INTC $AVGO $SPY
OI,O-I Glass Inc. Common Stock,14.47,-0.27,-0.02,Large,United States,1649710,Consumer Durables,23871303.7,TRUE,$BLL $CCK $ATR $SPY
ALRM,Alarm.com Holdings Inc. Common Stock,87.53,1.15,0.01,Large,United States,272182,Technology,23824090.46,TRUE,$ADBE $CRM $INTU $SPY
PGNY,Progyny Inc. Common Stock,45.65,1.14,0.03,Large,United States,521875,Health Care,23823593.75,TRUE,$UNH $ANTM $HUM $SPY
NVT,nVent Electric plc Ordinary Shares ,28.65,0.74,0.03,Large,,830318,Technology,23788610.7,TRUE,$NVT $CWR.L $DSCV.L $SPY
SAGE,Sage Therapeutics Inc. Common Stock,76.88,2.03,0.03,Large,United States,308437,Health Care,23712636.56,FALSE,$950160.KQ $ABBV $AMGN $SPY
AGIO,Agios Pharmaceuticals Inc. Common Stock,52.62,0.98,0.02,Large,United States,450276,Health Care,23693523.12,TRUE,$950160.KQ $ABBV $AMGN $SPY
PDCE,PDC Energy Inc. Common Stock (Delaware),35.97,1.57,0.05,Large,United States,657495,Energy,23650095.15,TRUE,$COP $EOG $PXD $SPY
BALY,Bally's Corporation Common Stock,65.29,0.31,0,Large,,361649,Consumer Services,23612063.21,TRUE,$LVS $DKNG $MGM $SPY
QTRX,Quanterix Corporation Common Stock,61.45,2.98,0.05,Large,United States,384173,Capital Goods,23607430.85,TRUE,$TMO $ILMN $A $SPY
BKU,BankUnited Inc. Common Stock,44.47,0.52,0.01,Large,United States,529851,Finance,23562473.97,TRUE,$TFC $PNC $FRC $SPY
ALTR,Altair Engineering Inc. Class A Common Stock,63.32,0.75,0.01,Large,United States,371110,Technology,23498685.2,TRUE,$ADBE $CRM $INTU $SPY
CTB,Cooper Tire & Rubber Company Common Stock,56.48,0.5,0.01,Large,United States,416012,Consumer Durables,23496357.76,TRUE,$900100.KQ $GT $CTB $SPY
AM,Antero Midstream Corporation Common Stock,9.12,0.09,0.01,Large,United States,2575134,Public Utilities,23485222.08,TRUE,$EPD $KMI $WMB $SPY
CHE,Chemed Corp,466.26,6.44,0.01,Large,United States,50229,Health Care,23419773.54,TRUE,$CVS $CI $LH $SPY
LIVN,LivaNova PLC Ordinary Shares,73.44,-0.29,0,Large,United Kingdom,318255,Health Care,23372647.2,TRUE,$SN.L $LIVN $OXFD $SPY
VVV,Valvoline Inc. Common Stock,26.17,0.1,0,Large,United States,891491,Basic Industries,23330319.47,TRUE,$DOW $WLK $OLN $SPY
FBP,First BanCorp. New Common Stock,11.43,0.17,0.02,Large,Puerto Rico,2038451,Finance,23299494.93,TRUE,$BPOP $FBP $OFG $SPY
OPCH,Option Care Health Inc. Common Stock,18.26,0.52,0.03,Large,United States,1269551,Health Care,23182001.26,TRUE,$CVS $CI $LH $SPY
RLAY,Relay Therapeutics Inc. Common Stock,36.2,1.63,0.05,Large,United States,638056,Health Care,23097627.2,TRUE,$950160.KQ $ABBV $AMGN $SPY
OGS,ONE Gas Inc. Common Stock,76.81,-0.1,0,Large,,299681,Public Utilities,23018497.61,TRUE,$ATO $UGI $NFG $SPY
COMM,CommScope Holding Company Inc. Common Stock,15.57,0.21,0.01,Large,United States,1477359,Technology,23002479.63,TRUE,$CSCO $MSI $ANET $SPY
ABR,Arbor Realty Trust Common Stock,16.16,0.26,0.02,Large,United States,1419578,Consumer Services,22940380.48,TRUE,$NLY $AGNC $STWD $SPY
AHCO,AdaptHealth Corp. Class A Common Stock,37.1,0.34,0.01,Large,United States,618135,Health Care,22932808.5,TRUE,$MCK $ABC $CAH $SPY
GDOT,Green Dot Corporation Class A Common Stock $0.001 par value,46.99,1.2,0.03,Large,United States,487387,Finance,22902315.13,TRUE,$AXP $COF $DFS $SPY
PRI,Primerica Inc. Common Stock,151.26,3.44,0.02,Large,United States,151347,Finance,22892747.22,TRUE,$MET $PRU $AFL $SPY
APPF,AppFolio Inc. Class A Common Stock,143,1.59,0.01,Large,United States,159735,Technology,22842105,TRUE,$ADBE $CRM $INTU $SPY
EPR,EPR Properties Common Stock,48.15,1.56,0.03,Large,United States,471328,Consumer Services,22694443.2,TRUE,$AMT $CCI $EQIX $SPY
REZI,Resideo Technologies Inc. Common Stock ,29.6,1.35,0.05,Large,,766653,Capital Goods,22692928.8,TRUE,$CARR $MAS $FBHS $SPY
WRI,Weingarten Realty Investors Common Stock,27.39,0.48,0.02,Large,United States,826071,Consumer Services,22626084.69,TRUE,$SPG $O $REG $SPY
VG,Vonage Holdings Corp. Common Stock,12.07,0.25,0.02,Large,United States,1872292,Public Utilities,22598564.44,TRUE,$LUMN $IRDM $CCOI $SPY
SWI,SolarWinds Corporation Common Stock,17.88,0.44,0.03,Large,United States,1263003,Technology,22582493.64,TRUE,$MSFT $ORCL $NOW $SPY
SWCH,Switch Inc. Class A Common Stock,16.74,0.48,0.03,Large,,1347374,Technology,22555040.76,TRUE,$SNOW $TWLO $OKTA $SPY
SDC,SmileDirectClub Inc. Class A Common Stock,10.5,0.19,0.02,Large,United States,2136301,Health Care,22431160.5,TRUE,$950130.KQ $ALGN $WST $SPY
BTG,B2Gold Corp Common shares (Canada),4.5,0.19,0.04,Large,Canada,4984400,Basic Industries,22429800,TRUE,$ABX.TO $FNV.TO $WPM.TO $SPY
ACHC,Acadia Healthcare Company Inc. Common Stock,56.8,-0.34,-0.01,Large,United States,394302,Health Care,22396353.6,TRUE,$HCA $UHS $EHC $SPY
CW,Curtiss-Wright Corporation Common Stock,119.93,1.33,0.01,Large,United States,186450,Technology,22360948.5,TRUE,$BA $RTX $LMT $SPY
KNSL,Kinsale Capital Group Inc. Common Stock,167.64,2.84,0.02,Large,United States,132459,Finance,22205426.76,TRUE,$PGR $TRV $ALL $SPY
ASND,Ascendis Pharma A/S American Depositary Shares,130.4,1.52,0.01,Large,Denmark,170268,Health Care,22202947.2,TRUE,$GMAB.CO $BAVA.CO $ZEAL.CO $SPY
KMPR,Kemper Corporation,81.14,1.42,0.02,Large,United States,273229,Finance,22169801.06,TRUE,$PGR $TRV $ALL $SPY
CWEN,Clearway Energy Inc. Class C Common Stock,28.86,0.72,0.03,Large,United States,766834,Public Utilities,22130829.24,TRUE,$AES $VST $CWEN.A $SPY
CBU,Community Bank System Inc. Common Stock,77.3,0.58,0.01,Large,United States,285742,Finance,22087856.6,TRUE,$TFC $PNC $FRC $SPY
PRFT,Perficient Inc. Common Stock,61,2.28,0.04,Large,United States,361945,Technology,22078645,TRUE,$IBM $CTSH $EPAM $SPY
ALLO,Allogene Therapeutics Inc. Common Stock,34.93,-0.37,-0.01,Large,United States,631503,Health Care,22058399.79,TRUE,$950160.KQ $ABBV $AMGN $SPY
GLPG,Galapagos NV American Depositary Shares,79.19,2.1,0.03,Large,Belgium,278521,Health Care,22056077.99,TRUE,$GLPG.AS $MDXH.BR $OXUR.BR $SPY
CCOI,Cogent Communications Holdings Inc.,68.41,-0.35,-0.01,Large,United States,321737,Consumer Services,22010028.17,TRUE,$LUMN $IRDM $CCOI $SPY
SPT,Sprout Social Inc Class A Common Stock,58.28,0.52,0.01,Large,United States,377103,Technology,21977562.84,TRUE,$ADBE $CRM $INTU $SPY
MATX,Matson Inc. Common Stock,67.32,0.62,0.01,Large,United States,325714,Consumer Services,21927066.48,TRUE,$KEX $MATX $CKH $SPY
GBCI,Glacier Bancorp Inc. Common Stock,58.59,1.51,0.03,Large,United States,373870,Finance,21905043.3,TRUE,$TFC $PNC $FRC $SPY
AEL,American Equity Investment Life Holding Company Common Stock,32.01,0.48,0.02,Large,United States,684075,Finance,21897240.75,FALSE,$MET $PRU $AFL $SPY
ATI,Allegheny Technologies Incorporated Common Stock,22,0.94,0.04,Large,United States,994175,Basic Industries,21871850,TRUE,$NUE $STLD $RS $SPY
BWXT,BWX Technologies Inc. Common Stock,66.87,0.93,0.01,Large,United States,326117,Energy,21807443.79,TRUE,$BA $RTX $LMT $SPY
NVMI,Nova Measuring Instruments Ltd. Ordinary Shares,95.59,4.58,0.05,Large,Israel,227752,Capital Goods,21770813.68,TRUE,$SEDG $NVMI $CAMT $SPY
FUN,Cedar Fair L.P. Common Stock,49.63,-0.05,0,Large,United States,437972,Consumer Services,21736550.36,TRUE,$MTN $PLNT $SIX $SPY
CRON,Cronos Group Inc. Common Share,9.41,-0.05,-0.01,Large,Canada,2306090,Consumer Durables,21700306.9,TRUE,$WEED.TO $BHC.TO $CURA.CN $SPY
PRG,PROG Holdings Inc. Common Stock,45.4,2.11,0.05,Large,United States,477554,Technology,21680951.6,TRUE,$AXP $COF $DFS $SPY
