Symbol,Name,Last Sale,Net Change,% Change,Market Cap,Country,Volume,Sector,Price x Volume,Smooth Test,Peers
ENVA,Enova International Inc. Common Stock,36.09,0.61,0.02,Medium,United States,297823,Finance,10748432.07,TRUE,$AXP $COF $DFS $SPY
VECO,Veeco Instruments Inc. Common Stock,21.59,0.85,0.04,Medium,United States,497610,Technology,10743399.9,TRUE,$AMAT $LRCX $KLAC $SPY
NPTN,NeoPhotonics Corporation Common Stock,12.75,0.8,0.07,Medium,United States,837939,Technology,10683722.25,TRUE,$NVDA $INTC $AVGO $SPY
IMVT,Immunovant Inc. Common Stock,16.85,0.81,0.05,Medium,United States,627593,Health Care,10574942.05,TRUE,$950160.KQ $ABBV $AMGN $SPY
REKR,Rekor Systems Inc. Common Stock,20.35,0.36,0.02,Medium,United States,517986,Capital Goods,10541015.1,TRUE,$950140.KQ $CSGP $VRSK $SPY
CHEF,The Chefs' Warehouse Inc. Common Stock,31.26,0.8,0.03,Medium,United States,336962,Consumer Non-Durables,10533432.12,FALSE,$SYY $USFD $PFGC $SPY
CORE,Core Mark Holding Co Inc Common Stock,40.05,1.36,0.04,Medium,United States,262964,Consumer Non-Durables,10531708.2,TRUE,$GPC $POOL $LKQ $SPY
NS,Nustar Energy L.P.  Common Units,17.76,0.67,0.04,Medium,United States,592632,Energy,10525144.32,TRUE,$EPD $KMI $WMB $SPY
EOLS,Evolus Inc. Common Stock,12.59,-0.4,-0.03,Medium,United States,835551,Health Care,10519587.09,TRUE,$JNJ $PFE $MRK $SPY
KROS,Keros Therapeutics Inc. Common Stock,58.76,-2.79,-0.05,Medium,United States,178835,Health Care,10508344.6,TRUE,$950160.KQ $ABBV $AMGN $SPY
CLLS,Cellectis S.A. American Depositary Shares,19.74,-0.47,-0.02,Medium,France,531303,Health Care,10487921.22,TRUE,$VLA.PA $ALCLS.PA $ALNOV.PA $SPY
ELF,e.l.f. Beauty Inc. Common Stock,26.94,0.11,0,Medium,United States,388082,Consumer Non-Durables,10454929.08,TRUE,$EL $COTY $NUS $SPY
SILK,Silk Road Medical Inc. Common Stock,51.1,0.45,0.01,Medium,United States,204086,Health Care,10428794.6,TRUE,$950130.KQ $ALGN $WST $SPY
DRNA,Dicerna Pharmaceuticals Inc. Common Stock,25.76,0.19,0.01,Medium,United States,403900,Health Care,10404464,TRUE,$950160.KQ $ABBV $AMGN $SPY
PAYA,Paya Holdings Inc. Class A Common Stock,11.45,0.49,0.04,Medium,United States,907126,Miscellaneous,10386592.7,TRUE,$V $MA $PYPL $SPY
KNSA,Kiniksa Pharmaceuticals Ltd. Class A Common Stock,18.48,-0.03,0,Medium,United States,561661,Health Care,10379495.28,TRUE,$KNSA $SPY
EVER,EverQuote Inc. Class A Common Stock,38.52,2.23,0.06,Medium,United States,269250,Technology,10371510,TRUE,$GOOGL $FB $SNAP $SPY
BJRI,BJ's Restaurants Inc. Common Stock,59.52,1.44,0.02,Medium,United States,174123,Consumer Services,10363800.96,TRUE,$MCD $SBUX $CMG $SPY
RILY,B. Riley Financial Inc. Common Stock,56.91,0.53,0.01,Medium,United States,181994,Miscellaneous,10357278.54,TRUE,$MS $SCHW $GS $SPY
SCHN,Schnitzer Steel Industries Inc. Class A Common Stock,42.78,0.99,0.02,Medium,United States,241750,Consumer Durables,10342065,TRUE,$NUE $STLD $RS $SPY
BOLT,Bolt Biotherapeutics Inc. Common Stock,31.46,-1.45,-0.04,Medium,United States,327132,Health Care,10291572.72,TRUE,$950160.KQ $ABBV $AMGN $SPY
EWTX,Edgewise Therapeutics Inc. Common Stock,30.01,-2.49,-0.08,Medium,United States,342346,Health Care,10273803.46,TRUE,$SPY $DIA $IWM $QQQ
FMTX,Forma Therapeutics Holdings Inc. Common Stock,27.68,-0.34,-0.01,Medium,United States,371161,Health Care,10273736.48,TRUE,$950160.KQ $ABBV $AMGN $SPY
BCAB,BioAtla Inc. Common Stock,51.09,0.25,0,Medium,United States,200867,Health Care,10262295.03,TRUE,$950160.KQ $ABBV $AMGN $SPY
KIDS,OrthoPediatrics Corp. Common Stock,50.36,1.61,0.03,Medium,United States,203358,Health Care,10241108.88,TRUE,$950130.KQ $ALGN $WST $SPY
PBI,Pitney Bowes Inc. Common Stock,8.3,0.06,0.01,Medium,United States,1232660,Miscellaneous,10231078,TRUE,$SPY $DIA $IWM $QQQ
VIOT,Viomi Technology Co. Ltd American Depositary Shares,9.27,0.27,0.03,Medium,China,1101328,Consumer Durables,10209310.56,TRUE,$000333.SZ $000651.SZ $600690.SS $SPY
ECPG,Encore Capital Group Inc Common Stock,40.36,0.13,0,Medium,United States,252764,Finance,10201555.04,TRUE,$AXP $COF $DFS $SPY
KALU,Kaiser Aluminum Corporation Common Stock,111.13,0.63,0.01,Medium,United States,91728,Capital Goods,10193732.64,TRUE,$AA $ARNC $KALU $SPY
PRQR,ProQR Therapeutics N.V. Ordinary Shares,6.54,-0.07,-0.01,Medium,Netherlands,1558139,Health Care,10190229.06,TRUE,$ARGX.BR $QURE $MRUS $SPY
EXPC,Experience Investment Corp. Class A Common Stock,10.53,0.24,0.02,Medium,United States,966634,Miscellaneous,10178656.02,TRUE,$SPY $DIA $IWM $QQQ
AKRO,Akero Therapeutics Inc. Common Stock,28.64,-0.37,-0.01,Medium,United States,354748,Health Care,10159982.72,TRUE,$950160.KQ $ABBV $AMGN $SPY
MYRG,MYR Group Inc. Common Stock,73.67,2,0.03,Medium,United States,137134,Basic Industries,10102661.78,TRUE,$PWR $ACM $MTZ $SPY
OLMA,Olema Pharmaceuticals Inc. Common Stock,34.39,1.21,0.04,Medium,United States,293487,Health Care,10093017.93,TRUE,$950160.KQ $ABBV $AMGN $SPY
FTCV,FinTech Acquisition Corp. V Class A Common Stock,11.04,-0.17,-0.02,Medium,United States,912762,Finance,10076892.48,TRUE,$SPY $DIA $IWM $QQQ
CATM,Cardtronics plc Class A Ordinary Shares (UK),38.9,0.1,0,Medium,United States,258398,Miscellaneous,10050390.21,TRUE,$CATM $CPI.L $EQN.L $SPY
TMST,TimkenSteel Corporation Common Shares,11.49,-0.26,-0.02,Medium,United States,873482,Basic Industries,10036308.18,TRUE,$NUE $STLD $RS $SPY
MILE,Metromile Inc. Common Stock,10.5,0.21,0.02,Medium,United States,955471,Finance,10032445.5,TRUE,$PGR $TRV $ALL $SPY
AIR,AAR Corp. Common Stock,42.11,0.46,0.01,Medium,United States,238136,Capital Goods,10027906.96,TRUE,$BA $RTX $LMT $SPY
OII,Oceaneering International Inc. Common Stock,12.36,0.94,0.08,Medium,United States,807932,Energy,9986039.52,TRUE,$SLB $BKR $HAL $SPY
PRLD,Prelude Therapeutics Incorporated Common Stock,41.25,-2.08,-0.05,Medium,United States,242048,Health Care,9984480,TRUE,$950160.KQ $ABBV $AMGN $SPY
BDC,Belden Inc Common Stock,44.66,0.29,0.01,Medium,United States,222937,Basic Industries,9956366.42,TRUE,$APH $GLW $DLB $SPY
CSGS,CSG Systems International Inc. Common Stock,45.88,0.99,0.02,Medium,United States,216944,Technology,9953390.72,TRUE,$V $MA $PYPL $SPY
GNL,Global Net Lease Inc. Common Stock,18.59,0.53,0.03,Medium,United States,534823,Consumer Services,9942359.57,TRUE,$WPC $VER $STOR $SPY
GHVI,Gores Holdings VI Inc. Class A Common Stock,14.1,0.4,0.03,Medium,United States,704849,Finance,9938370.9,TRUE,$SPY $DIA $IWM $QQQ
MEI,Methode Electronics Inc. Common Stock,42.97,0.99,0.02,Medium,United States,231049,Capital Goods,9928175.53,TRUE,$IPGP $JBL $SANM $SPY
WBAI,500.com Limited American Depositary Shares each representing 10 Class A shares,22.75,1.38,0.06,Medium,,435072,Consumer Services,9897888,FALSE,$WBAI $SPY
TRIT,Triterras Inc. Class A Ordinary Shares,7.49,0.24,0.03,Medium,Singapore,1319052,Technology,9879699.48,TRUE,$NVGI $TRIT $8353.HK $SPY
SWIR,Sierra Wireless Inc. Common Stock,15.3,0.53,0.04,Medium,Canada,643165,Technology,9840424.5,TRUE,$ET.TO $SWIR $STC.V $SPY
NYMT,New York Mortgage Trust Inc. Common Stock,4.57,0.1,0.02,Medium,United States,2149241,Consumer Services,9822031.37,TRUE,$NLY $AGNC $STWD $SPY
DCRB,Decarbonization Plus Acquisition Corporation Class A Common Stock,10.87,0.38,0.04,Medium,United States,902663,Finance,9811946.81,TRUE,$SPY $DIA $IWM $QQQ
KALA,Kala Pharmaceuticals Inc. Common Stock,7.11,0.37,0.05,Medium,United States,1377738,Health Care,9795717.18,TRUE,$JNJ $PFE $MRK $SPY
KRA,Kraton Corporation Common Stock,37.31,0.72,0.02,Medium,United States,262421,Basic Industries,9790927.51,TRUE,$SHW $ECL $DD $SPY
ASTE,Astec Industries Inc. Common Stock,77,1.58,0.02,Medium,United States,126791,Capital Goods,9762907,TRUE,$CAT $CMI $PCAR $SPY
ADCT,ADC Therapeutics SA Common Shares,25.52,1.11,0.05,Medium,,382417,Health Care,9759281.84,TRUE,$CRSP $IDIA.SW $ADCT $SPY
VREX,Varex Imaging Corporation Common Stock,20.88,0.39,0.02,Medium,United States,465856,Capital Goods,9727073.28,TRUE,$ABT $DHR $SYK $SPY
RCKY,Rocky Brands Inc. Common Stock,56.97,2.91,0.05,Medium,United States,169270,Consumer Non-Durables,9643311.9,TRUE,$NKE $DECK $SKX $SPY
ATOM,Atomera Incorporated Common Stock,25.7,1.2,0.05,Medium,United States,374556,Technology,9626089.2,TRUE,$AMAT $LRCX $KLAC $SPY
SEMR,SEMrush Holdings Inc. Class A Common Stock,12.78,0.87,0.07,Medium,,751911,Technology,9609422.58,TRUE,$ADBE $CRM $INTU $SPY
SBLK,Star Bulk Carriers Corp. Common Shares,14.49,-0.19,-0.01,Medium,Greece,663083,Transportation,9608072.67,TRUE,$SBLK $DAC $DSX $SPY
HA,Hawaiian Holdings Inc. Common Stock,26.81,0.14,0.01,Medium,United States,357194,Transportation,9576371.14,TRUE,$LUV $DAL $UAL $SPY
AFMD,Affimed N.V.,7.78,-0.13,-0.02,Medium,Germany,1223763,Health Care,9520876.14,TRUE,$BNTX $CVAC $MOR.DE $SPY
RGNX,REGENXBIO Inc. Common Stock,34.36,0.25,0.01,Medium,United States,276993,Health Care,9517479.48,TRUE,$950160.KQ $ABBV $AMGN $SPY
VBIV,VBI Vaccines Inc. New Common Stock (Canada),3.12,0.01,0,Medium,United States,3043215,Health Care,9494830.8,TRUE,$950160.KQ $ABBV $AMGN $SPY
VNDA,Vanda Pharmaceuticals Inc. Common Stock,15.71,0.69,0.05,Medium,United States,601853,Health Care,9455110.63,TRUE,$950160.KQ $ABBV $AMGN $SPY
QD,Qudian Inc. American Depositary Shares each representing one Class A Ordinary Share,2.29,0.01,0,Medium,China,4111125,Finance,9414476.25,TRUE,$LU $2858.HK $600817.SS $SPY
TLGA,TLG Acquisition One Corp. Class A Common Stock,9.69,0.01,0,Medium,,970485,Finance,9403999.65,TRUE,$SPY $DIA $IWM $QQQ
OSUR,OraSure Technologies Inc. Common Stock,11.68,0.01,0,Medium,United States,803677,Health Care,9386947.36,TRUE,$950130.KQ $ALGN $WST $SPY
AGEN,Agenus Inc. Common Stock,2.87,0.15,0.06,Medium,United States,3257756,Health Care,9349759.72,TRUE,$950160.KQ $ABBV $AMGN $SPY
WPF,Foley Trasimene Acquisition Corp. Class A CommonStock,10.14,0.1,0.01,Medium,United States,918969,Finance,9318345.66,TRUE,$SPY $DIA $IWM $QQQ
NTGR,NETGEAR Inc. Common Stock,41.75,0.65,0.02,Medium,United States,222797,Public Utilities,9301774.75,TRUE,$CSCO $MSI $ANET $SPY
SVAC,Starboard Value Acquisition Corp. Class A Common Stock,9.92,-0.01,0,Medium,United States,935363,Finance,9278800.96,TRUE,$SPY $DIA $IWM $QQQ
EPZM,Epizyme Inc. Common Stock,8.63,-0.08,-0.01,Medium,United States,1072029,Health Care,9251610.27,TRUE,$950160.KQ $ABBV $AMGN $SPY
DLX,Deluxe Corporation Common Stock,42.34,0.38,0.01,Medium,United States,218212,Consumer Durables,9239096.08,TRUE,$BRC $BEEN $DLX $SPY
ERF,Enerplus Corporation Common Stock,5.27,0.26,0.05,Medium,Canada,1751864,Energy,9232323.28,TRUE,$CNQ.TO $TOU.TO $IPCO.ST $SPY
ADUS,Addus HomeCare Corporation Common Stock,106.49,1.9,0.02,Medium,United States,86692,Health Care,9231831.08,TRUE,$CVS $CI $LH $SPY
RVP,Retractable Technologies Inc. Common Stock,12.46,-0.36,-0.03,Medium,United States,740621,Health Care,9228137.66,TRUE,$950130.KQ $ALGN $WST $SPY
CXW,CoreCivic Inc. Common Stock,8.84,-0.21,-0.02,Medium,United States,1041615,Consumer Services,9207876.6,TRUE,$ADT $BCO $CXW $SPY
VRTV,Veritiv Corporation Common Stock,43.21,0.67,0.02,Medium,,212261,Consumer Services,9171797.81,TRUE,$FAST $URI $GWW $SPY
PRTA,Prothena Corporation plc Ordinary Shares,24.74,-0.38,-0.02,Medium,United States,370639,Health Care,9169608.86,TRUE,$ALKS $AMRN $PRTA $SPY
MESA,Mesa Air Group Inc. Common Stock,13.29,-0.16,-0.01,Medium,United States,688548,Transportation,9150802.92,TRUE,$LUV $DAL $UAL $SPY
LTC,LTC Properties Inc. Common Stock,43.14,1.42,0.03,Medium,United States,212068,Consumer Services,9148613.52,TRUE,$WELL $VTR $PEAK $SPY
GTN,Gray Television Inc. Common Stock,18.92,0.52,0.03,Medium,United States,483496,Consumer Services,9147744.32,TRUE,$VIAC $FOXA $DISCA $SPY
TEN,Tenneco Inc. Class A Voting Common Stock,10.75,0.03,0,Medium,United States,846996,Capital Goods,9105207,TRUE,$1316.HK $QS $BWA $SPY
QNST,QuinStreet Inc. Common Stock,20.7,0.4,0.02,Medium,United States,437688,Miscellaneous,9060141.6,TRUE,$GOOGL $FB $SNAP $SPY
GMS,GMS Inc. Common Stock,41.88,0.13,0,Medium,United States,216178,Consumer Services,9053534.64,TRUE,$FAST $URI $GWW $SPY
DESP,Despegar.com Corp. Ordinary Shares,14.25,0.62,0.05,Medium,,635328,Consumer Services,9053424,TRUE,$MELI $DESP $SPY
SCS,Steelcase Inc. Common Stock,14.47,0.08,0.01,Medium,United States,625463,Consumer Durables,9050449.61,TRUE,$MSA $MLHR $HNI $SPY
YQ,17 Education & Technology Group Inc. American Depositary Shares,7.49,0.35,0.05,Medium,China,1207375,Consumer Services,9043238.75,TRUE,$SPY $DIA $IWM $QQQ
CAL,Caleres Inc. Common Stock,21.6,-0.2,-0.01,Medium,United States,417421,Consumer Non-Durables,9016293.6,TRUE,$TJX $ROST $BURL $SPY
ILPT,Industrial Logistics Properties Trust Common Shares of Beneficial Interest,23.65,0.52,0.02,Medium,United States,381035,Consumer Services,9011477.75,TRUE,$PLD $DRE $COLD $SPY
DENN,Denny's Corporation Common Stock,18.27,0.16,0.01,Medium,United States,492697,Consumer Services,9001574.19,TRUE,$MCD $SBUX $CMG $SPY
INTZ,Intrusion Inc. Common Stock,25.21,1.84,0.08,Medium,United States,356629,Technology,8990617.09,FALSE,$MSFT $ORCL $NOW $SPY
DX,Dynex Capital Inc. Common Stock,19.02,0.09,0,Medium,United States,470112,Consumer Services,8941530.24,TRUE,$NLY $AGNC $STWD $SPY
NPO,EnPro Industries Inc,85.46,0.19,0,Medium,United States,104370,Basic Industries,8919460.2,TRUE,$ITW $PH $SWK $SPY
TVTX,Travere Therapeutics Inc. Common Stock,25.74,0.77,0.03,Medium,United States,346490,Health Care,8918652.6,TRUE,$950160.KQ $ABBV $AMGN $SPY
VGAC,VG Acquisition Corp. Class A Ordinary Shares,10.2,0.03,0,Medium,,873112,Finance,8905742.4,TRUE,$SPY $DIA $IWM $QQQ
ARI,Apollo Commercial Real Estate Finance Inc,14.21,0.24,0.02,Medium,United States,625125,Consumer Services,8883026.25,TRUE,$NLY $AGNC $STWD $SPY
PRGS,Progress Software Corporation Common Stock (DE),45.04,0.98,0.02,Medium,United States,196578,Technology,8853873.12,TRUE,$MSFT $ORCL $NOW $SPY
STRL,Sterling Construction Company Inc Common Stock,23.14,-0.06,0,Medium,United States,382163,Basic Industries,8843251.82,TRUE,$PWR $ACM $MTZ $SPY
ACRE,Ares Commercial Real Estate Corporation Common Stock,13.96,0.24,0.02,Medium,United States,632914,Consumer Services,8835479.44,TRUE,$NLY $AGNC $STWD $SPY
RWT,Redwood Trust Inc. Common Stock,10.69,0.28,0.03,Medium,United States,826088,Consumer Services,8830880.72,TRUE,$NLY $AGNC $STWD $SPY
FDMT,4D Molecular Therapeutics Inc. Common Stock,40.04,-3.34,-0.08,Medium,United States,220081,Health Care,8812043.24,TRUE,$950160.KQ $ABBV $AMGN $SPY
CLB,Core Laboratories N.V. Common Stock,30.1,1.31,0.05,Medium,Netherlands,292468,Energy,8803286.8,TRUE,$SBMO.AS $CLB $FUR.AS $SPY
LL,Lumber Liquidators Holdings Inc Common Stock,26.17,1.05,0.04,Medium,United States,336085,Consumer Services,8795344.45,TRUE,$HD $LOW $FND $SPY
GWB,Great Western Bancorp Inc. Common Stock,30.69,0.4,0.01,Medium,United States,286241,Finance,8784736.29,TRUE,$TFC $PNC $FRC $SPY
KRYS,Krystal Biotech Inc. Common Stock,76.72,-0.32,0,Medium,United States,113941,Health Care,8741553.52,TRUE,$950160.KQ $ABBV $AMGN $SPY
CRY,CryoLife Inc. Common Stock,22.76,0.18,0.01,Medium,United States,383675,Health Care,8732443,TRUE,$ABT $DHR $SYK $SPY
SLCA,U.S. Silica Holdings Inc. Common Stock,13.02,0.73,0.06,Medium,United States,669028,Basic Industries,8710744.56,TRUE,$SLB $BKR $HAL $SPY
TBPH,Theravance Biopharma Inc. Ordinary Shares,20.12,-0.29,-0.01,Medium,Cayman Islands,432747,Health Care,8706869.64,TRUE,$TBPH $SPY
ZYME,Zymeworks Inc. Common Shares,31.46,-0.12,0,Medium,Canada,276023,Health Care,8683683.58,TRUE,$AUP.TO $ZYME $TRIL.TO $SPY
CUTR,Cutera Inc. Common Stock,31,0.95,0.03,Medium,United States,279986,Health Care,8679566,TRUE,$ABT $DHR $SYK $SPY
TRVG,trivago N.V. American Depositary Shares,4.5,0.2,0.05,Medium,Germany,1928588,Technology,8678646,TRUE,$G24.DE $TRVG $NWO.DE $SPY
TPC,Tutor Perini Corporation Common Stock,18.98,0.03,0,Medium,United States,456208,Basic Industries,8658827.84,TRUE,$PWR $ACM $MTZ $SPY
LTRPA,Liberty TripAdvisor Holdings Inc. Series A Common Stock,6.68,0.3,0.05,Medium,United States,1291341,Technology,8626157.88,TRUE,$GOOGL $FB $SNAP $SPY
AZZ,AZZ Inc.,51.04,0.69,0.01,Medium,United States,168667,Consumer Durables,8608763.68,TRUE,$BE $TPIC $AZZ $SPY
APTO,Aptose Biosciences Inc. Common Shares,6,0.03,0,Medium,Canada,1429968,Health Care,8579808,TRUE,$AUP.TO $ZYME $TRIL.TO $SPY
SPH,Suburban Propane Partners L.P. Common Stock,15.03,0.21,0.01,Medium,United States,570434,Consumer Services,8573623.02,TRUE,$ATO $UGI $NFG $SPY
CLI,Mack-Cali Realty Corporation Common Stock,15.73,0.25,0.02,Medium,United States,543244,Consumer Services,8545228.12,TRUE,$ARE $BXP $VNO $SPY
ARCB,ArcBest Corporation Common Stock,71.99,1.62,0.02,Medium,United States,118346,Transportation,8519728.54,TRUE,$UBER $ODFL $LYFT $SPY
SESN,Sesen Bio Inc. Common Stock,2.71,0.11,0.04,Medium,United States,3141264,Health Care,8512825.44,TRUE,$950160.KQ $ABBV $AMGN $SPY
VAPO,Vapotherm Inc. Common Stock,23.49,-0.53,-0.02,Medium,United States,362153,Health Care,8506973.97,TRUE,$ABT $DHR $SYK $SPY
OAS,Oasis Petroleum Inc. Common Stock,61.44,2.05,0.03,Medium,United States,138288,Energy,8496414.72,FALSE,$COP $EOG $PXD $SPY
CVM,Cel-Sci Corporation Common Stock,16.47,1.26,0.08,Medium,United States,514933,Health Care,8480946.51,TRUE,$950160.KQ $ABBV $AMGN $SPY
EVRI,Everi Holdings Inc. Common Stock,14.42,0.31,0.02,Medium,United States,587932,Consumer Services,8477979.44,TRUE,$LVS $DKNG $MGM $SPY
CHUY,Chuy's Holdings Inc. Common Stock,45.48,1.16,0.03,Medium,United States,186386,Consumer Services,8476835.28,TRUE,$MCD $SBUX $CMG $SPY
ZNTL,Zentalis Pharmaceuticals Inc. Common Stock,43.34,-0.05,0,Medium,United States,195162,Health Care,8458321.08,TRUE,$950160.KQ $ABBV $AMGN $SPY
SGH,SMART Global Holdings Inc. Ordinary Shares,48.55,2.53,0.06,Medium,United States,174186,Technology,8456730.3,TRUE,$NVDA $INTC $AVGO $SPY
ALEX,Alexander & Baldwin Inc. Common Stock REIT Holding Company,17.3,0.51,0.03,Medium,United States,487558,Consumer Services,8434753.4,TRUE,$WPC $VER $STOR $SPY
ASIX,AdvanSix Inc. Common Stock ,27.93,1.11,0.04,Medium,United States,301192,Basic Industries,8412292.56,TRUE,$DOW $WLK $OLN $SPY
FTHM,Fathom Holdings Inc. Common Stock,37.02,0.39,0.01,Medium,United States,227043,Finance,8405131.86,TRUE,$CBRE $OPEN $JLL $SPY
JRVR,James River Group Holdings Ltd. Common Shares,46.4,0.78,0.02,Medium,Bermuda,180775,Finance,8387960,TRUE,$ACGL $AXS $AGO $SPY
CBAT,CBAK Energy Technology Inc. Common Stock,5.27,0.17,0.03,Medium,China,1588911,Miscellaneous,8373560.97,FALSE,$300750.SZ $300014.SZ $603195.SS $SPY
STAR          ,iStar Inc. Common Stock,18.2,0.42,0.02,Medium,United States,459198,Consumer Services,8357403.6,TRUE,$WPC $VER $STOR $SPY
VIH,VPC Impact Acquisition Holdings Class A Ordinary Shares,14.06,1.07,0.08,Medium,United States,592480,Technology,8330268.8,FALSE,$SPY $DIA $IWM $QQQ
CPF,Central Pacific Financial Corp New,27.23,0.55,0.02,Medium,United States,305793,Finance,8326743.39,TRUE,$TFC $PNC $FRC $SPY
PUMP,ProPetro Holding Corp. Common Stock,11.13,0.47,0.04,Medium,United States,745834,Energy,8301132.42,TRUE,$SLB $BKR $HAL $SPY
CRTX,Cortexyme Inc. Common Stock,37.34,1.31,0.04,Medium,United States,222032,Health Care,8290674.88,TRUE,$950160.KQ $ABBV $AMGN $SPY
FBRX,Forte Biosciences Inc. Common Stock,32.07,-2.2,-0.06,Medium,United States,258070,Health Care,8276304.9,TRUE,$950160.KQ $ABBV $AMGN $SPY
ARDX,Ardelyx Inc. Common Stock,6.86,0.24,0.04,Medium,United States,1205031,Health Care,8266512.66,TRUE,$950160.KQ $ABBV $AMGN $SPY
RADI,Radius Global Infrastructure Inc. Class A Common Stock,14.55,-0.15,-0.01,Medium,United States,567277,Consumer Services,8253880.35,TRUE,$VZ $T $RADI $SPY
TRHC,Tabula Rasa HealthCare Inc. Common Stock,46.9,0.85,0.02,Medium,United States,175727,Miscellaneous,8241596.3,TRUE,$VEEV $TDOC $CERN $SPY
SITM,SiTime Corporation Common Stock,105.3,6.7,0.07,Medium,United States,78059,Technology,8219612.7,TRUE,$NVDA $INTC $AVGO $SPY
NBHC,National Bank Holdings Corporation Common Stock,40.16,0.48,0.01,Medium,United States,202393,Finance,8128102.88,TRUE,$TFC $PNC $FRC $SPY
ZUMZ,Zumiez Inc. Common Stock,43.5,0.6,0.01,Medium,United States,186676,Consumer Services,8120406,TRUE,$TJX $ROST $BURL $SPY
NVEE,NV5 Global Inc. Common Stock,96.14,-0.43,0,Medium,United States,84268,Consumer Services,8101525.52,FALSE,$PWR $ACM $MTZ $SPY
IRT,Independence Realty Trust Inc. Common Stock,15.58,0.38,0.03,Medium,United States,516737,Consumer Services,8050762.46,TRUE,$EQR $AVB $INVH $SPY
RDUS,Radius Health Inc. Common Stock,20.7,-0.16,-0.01,Medium,United States,387402,Health Care,8019221.4,TRUE,$950160.KQ $ABBV $AMGN $SPY
FRTA,Forterra Inc. Common Stock,23.47,0.22,0.01,Medium,United States,341535,Capital Goods,8015826.45,TRUE,$VMC $MLM $EXP $SPY
MGPI,MGP Ingredients Inc.,59.39,0.24,0,Medium,United States,134866,Consumer Non-Durables,8009691.74,TRUE,$STZ $BF.B $MGPI $SPY
BDTX,Black Diamond Therapeutics Inc. Common Stock,25.47,1.21,0.05,Medium,United States,313421,Health Care,7982832.87,TRUE,$950160.KQ $ABBV $AMGN $SPY
FRSX,Foresight Autonomous Holdings Ltd. American Depositary Shares,6.09,-0.16,-0.03,Medium,Israel,1306538,Technology,7956816.42,FALSE,$FRSX.TA $RVL.TA $SHNP.TA $SPY
DS,Drive Shack Inc.,3.39,0.18,0.06,Medium,United States,2339296,Consumer Services,7930213.44,TRUE,$MTN $PLNT $SIX $SPY
EVOP,EVO Payments Inc. Class A Common Stock,28.24,0.72,0.03,Medium,United States,280740,Miscellaneous,7928097.6,TRUE,$V $MA $PYPL $SPY
PI,Impinj Inc. Common Stock,58.96,2.09,0.04,Medium,United States,134427,Capital Goods,7925815.92,TRUE,$NVDA $INTC $AVGO $SPY
EIG,Employers Holdings Inc Common Stock,42.05,-1.01,-0.02,Medium,United States,188095,Finance,7909394.75,TRUE,$PGR $TRV $ALL $SPY
SCVL,Shoe Carnival Inc. Common Stock,60.44,-1.3,-0.02,Medium,United States,129875,Consumer Services,7849645,TRUE,$TJX $ROST $BURL $SPY
INGN,Inogen Inc Common Stock,52.79,0.27,0.01,Medium,United States,148522,Health Care,7840476.38,TRUE,$ABT $DHR $SYK $SPY
PRAA,PRA Group Inc. Common Stock,37.68,0.61,0.02,Medium,United States,207496,Finance,7818449.28,TRUE,$AXP $COF $DFS $SPY
VITL,Vital Farms Inc. Common Stock,21.96,0.12,0.01,Medium,United States,355679,Consumer Non-Durables,7810710.84,TRUE,$MDLZ $KHC $GIS $SPY
AMSC,American Superconductor Corporation Common Stock,19.29,0.33,0.02,Medium,United States,404145,Consumer Durables,7795957.05,TRUE,$EMR $3665.TW $ROK $SPY
KALV,KalVista Pharmaceuticals Inc. Common Stock,27.46,1.77,0.07,Medium,United Kingdom,282546,Health Care,7758713.16,FALSE,$950160.KQ $ABBV $AMGN $SPY
TBBK,The Bancorp Inc Common Stock,21.13,0.41,0.02,Medium,United States,366776,Finance,7749976.88,TRUE,$TFC $PNC $FRC $SPY
AAT,American Assets Trust Inc. Common Stock,33.02,0.58,0.02,Medium,United States,234267,Consumer Services,7735496.34,TRUE,$WPC $VER $STOR $SPY
GATO,Gatos Silver Inc. Common Stock,10.49,0.52,0.05,Medium,United States,737164,Basic Industries,7732850.36,TRUE,$HL $GATO $SPY
XNET,Xunlei Limited American Depositary Receipts,6.65,0.11,0.02,Medium,China,1160784,Technology,7719213.6,TRUE,$688111.SS $600588.SS $002230.SZ $SPY
HURN,Huron Consulting Group Inc. Common Stock,51.78,1.4,0.03,Medium,United States,148991,Consumer Services,7714753.98,TRUE,$950140.KQ $CSGP $VRSK $SPY
XPEL,XPEL Inc. Common Stock,54.76,2.83,0.05,Medium,United States,140828,Capital Goods,7711741.28,TRUE,$1316.HK $QS $BWA $SPY
AROC,Archrock Inc. Common Stock,9.78,0.29,0.03,Medium,United States,786143,Public Utilities,7688478.54,TRUE,$SLB $BKR $HAL $SPY
HBM,Hudbay Minerals Inc. Ordinary Shares (Canada),7.28,0.41,0.06,Medium,Canada,1055036,Basic Industries,7680662.08,TRUE,$TECK $IVN.TO $TRQ.TO $SPY
PCVX,Vaxcyte Inc. Common Stock,20.93,1.18,0.06,Medium,United States,366413,Health Care,7669024.09,TRUE,$950160.KQ $ABBV $AMGN $SPY
CLPT,ClearPoint Neuro Inc. Common Stock,21.58,0.44,0.02,Medium,United States,354957,Health Care,7659972.06,TRUE,$ABT $DHR $SYK $SPY
CLW,Clearwater Paper Corporation Common Stock,37.6,-0.02,0,Medium,United States,203483,Basic Industries,7650960.8,TRUE,$UFS $SWM $NP $SPY
STKL,SunOpta Inc. Common Stock,14.84,0.07,0,Medium,Canada,515450,Consumer Services,7649278,TRUE,$SAP.TO $PBH.TO $MFI.TO $SPY
LASR,nLIGHT Inc. Common Stock,33.2,0.8,0.02,Medium,United States,230270,Technology,7644964,TRUE,$KEYS $ZBRA $TRMB $SPY
AEGN,Aegion Corp Common Stock,29.2,0.45,0.02,Medium,United States,261676,Basic Industries,7640939.2,TRUE,$PWR $ACM $MTZ $SPY
HNI,HNI Corporation Common Stock,39.6,0.04,0,Medium,United States,192531,Consumer Durables,7624227.6,TRUE,$MSA $MLHR $HNI $SPY
ARLO,Arlo Technologies Inc. Common Stock,6.53,0.25,0.04,Medium,United States,1165794,Consumer Non-Durables,7612634.82,TRUE,$KEYS $ZBRA $TRMB $SPY
VVI,Viad Corp Common Stock,43.55,1.8,0.04,Medium,United States,174427,Miscellaneous,7596295.85,TRUE,$CTAS $CPRT $IAA $SPY
RADA,RADA Electronic Industries Ltd. Ordinary Shares,12.54,0.53,0.04,Medium,Israel,603854,Technology,7572329.16,TRUE,$ESLT.TA $RADA.TA $ISHI.TA $SPY
LADR,Ladder Capital Corp Class A Common Stock,11.81,0.01,0,Medium,,639141,Consumer Services,7548255.21,TRUE,$NLY $AGNC $STWD $SPY
VBTX,Veritex Holdings Inc. Common Stock,32.84,0.12,0,Medium,United States,229009,Finance,7520655.56,TRUE,$TFC $PNC $FRC $SPY
EVH,Evolent Health Inc Class A Common Stock,20.67,0.47,0.02,Medium,United States,363792,Consumer Services,7519580.64,TRUE,$VEEV $TDOC $CERN $SPY
ESPR,Esperion Therapeutics Inc. Common Stock,28.71,0.66,0.02,Medium,United States,261666,Health Care,7512430.86,TRUE,$950160.KQ $ABBV $AMGN $SPY
NGD,New Gold Inc.,1.63,0.09,0.06,Medium,Canada,4604504,Basic Industries,7505341.52,TRUE,$ABX.TO $FNV.TO $WPM.TO $SPY
ADVM,Adverum Biotechnologies Inc. Common Stock,10.08,0.22,0.02,Medium,United States,744118,Health Care,7500709.44,TRUE,$950160.KQ $ABBV $AMGN $SPY
OCFC,OceanFirst Financial Corp. Common Stock,23.79,-0.15,-0.01,Medium,United States,314835,Finance,7489924.65,TRUE,$TFC $PNC $FRC $SPY
