Symbol,Name,Last Sale,Net Change,% Change,Market Cap,Country,Volume,Sector,Price x Volume,Smooth Test,Peers
TISI,Team Inc. Common Stock,12.01,0.48,0.04,Medium,United States,428016,Consumer Services,5140472.16,TRUE,$WM $RSG $ROL $SPY
BANC,Banc of California Inc. Common Stock,18.24,0.16,0.01,Medium,United States,281611,Finance,5136584.64,TRUE,$TFC $PNC $FRC $SPY
IIIV,i3 Verticals Inc. Class A Common Stock,31.65,0.53,0.02,Medium,United States,161379,Miscellaneous,5107645.35,TRUE,$V $MA $PYPL $SPY
CRHC,Cohn Robbins Holdings Corp. Class A Ordinary Shares,9.89,0.06,0.01,Medium,United States,514292,Finance,5086347.88,TRUE,$SPY $DIA $IWM $QQQ
XOG,Extraction Oil & Gas Inc. Common Stock,36.03,0.09,0,Medium,United States,141157,Energy,5085180.93,FALSE,$COP $EOG $PXD $SPY
FI,Frank's International N.V. Common Stock,3.81,0.26,0.07,Medium,,1333391,Energy,5080219.71,TRUE,$SBMO.AS $CLB $FUR.AS $SPY
IPOD,Social Capital Hedosophia Holdings Corp. IV Class A Ordinary Shares,11.17,0.21,0.02,Medium,United States,454595,Finance,5077826.15,TRUE,$SPY $DIA $IWM $QQQ
NBTB,NBT Bancorp Inc. Common Stock,39.54,-0.36,-0.01,Medium,United States,128247,Finance,5070886.38,TRUE,$TFC $PNC $FRC $SPY
CSSE,Chicken Soup for the Soul Entertainment Inc. Class A Common Stock,27.97,3.91,0.16,Medium,United States,181170,Consumer Services,5067324.9,TRUE,$DIS $NFLX $ROKU $SPY
DMYI,dMY Technology Group Inc. III Class A Common Stock,10.57,-0.2,-0.02,Medium,United States,478398,Finance,5056666.86,TRUE,$SPY $DIA $IWM $QQQ
HSC,Harsco Corporation Common Stock,17.84,0.69,0.04,Medium,United States,283399,Consumer Services,5055838.16,TRUE,$WM $RSG $ROL $SPY
CRMD,CorMedix Inc. Common Stock,10.09,0.1,0.01,Medium,United States,500421,Health Care,5049247.89,TRUE,$JNJ $PFE $MRK $SPY
OFG,OFG Bancorp Common Stock,23.07,0.45,0.02,Medium,Puerto Rico,217007,Finance,5006351.49,TRUE,$BPOP $FBP $OFG $SPY
FRG,Franchise Group Inc. Common Stock,36.83,0.72,0.02,Medium,United States,135723,Miscellaneous,4998678.09,TRUE,$TGT $DG $DLTR $SPY
ADAP,Adaptimmune Therapeutics plc American Depositary Shares,5.5,0.19,0.04,Medium,United Kingdom,907241,Health Care,4989825.5,FALSE,$GNS.L $ABC.L $MYOV $SPY
BSM,Black Stone Minerals L.P. Common units representing limited partner interests,9.13,0.41,0.05,Medium,United States,545550,Energy,4980871.5,TRUE,$COP $EOG $PXD $SPY
MCB,Metropolitan Bank Holding Corp. Common Stock,52.74,2.38,0.05,Medium,,94152,Finance,4965576.48,TRUE,$TFC $PNC $FRC $SPY
ECHO,Echo Global Logistics Inc. Common Stock,31.83,0.42,0.01,Medium,United States,155592,Transportation,4952493.36,TRUE,$UPS $FDX $EXPD $SPY
BXC,Bluelinx Holdings Inc. Common Stock,40.42,1.23,0.03,Medium,United States,121033,Capital Goods,4892153.86,TRUE,$FAST $URI $GWW $SPY
HEC,Hudson Executive Investment Corp. Class A Common Stock,10.01,0.09,0.01,Medium,United States,488338,Health Care,4888263.38,TRUE,$SPY $DIA $IWM $QQQ
BDSI,BioDelivery Sciences International Inc. Common Stock,3.74,-0.17,-0.04,Medium,United States,1302677,Health Care,4872011.98,TRUE,$JNJ $PFE $MRK $SPY
ABUS,Arbutus Biopharma Corporation Common Stock,3.43,0.1,0.03,Medium,Canada,1419754,Health Care,4869756.22,TRUE,$950160.KQ $ABBV $AMGN $SPY
ICLK,iClick Interactive Asia Group Limited American Depositary Shares,12.42,0.65,0.06,Medium,Hong Kong,391867,Technology,4866988.14,TRUE,$100.HK $752.HK $1993.HK $SPY
PGTI,PGT Innovations Inc.,25.68,0.43,0.02,Medium,United States,189457,Capital Goods,4865255.76,TRUE,$CARR $MAS $FBHS $SPY
ZEUS,Olympic Steel Inc. Common Stock,30.53,1.08,0.04,Medium,United States,159266,Basic Industries,4862390.98,TRUE,$NUE $STLD $RS $SPY
LQDT,Liquidity Services Inc. Common Stock,19.43,0.85,0.05,Medium,United States,250090,Miscellaneous,4859248.7,TRUE,$AMZN $BKNG $DASH $SPY
SHYF,The Shyft Group Inc. Common Stock,37.93,0.73,0.02,Medium,United States,128038,Capital Goods,4856481.34,TRUE,$CAT $CMI $PCAR $SPY
SOLY,Soliton Inc. Common Stock,18.85,1.28,0.07,Medium,United States,257633,Health Care,4856382.05,TRUE,$ABT $DHR $SYK $SPY
CPRX,Catalyst Pharmaceuticals Inc. Common Stock,4.51,-0.1,-0.02,Medium,United States,1074874,Health Care,4847681.74,TRUE,$950160.KQ $ABBV $AMGN $SPY
MTW,Manitowoc Company Inc. (The) Common Stock,20.61,-0.01,0,Medium,United States,235112,Capital Goods,4845658.32,TRUE,$CAT $CMI $PCAR $SPY
PASG,Passage Bio Inc. Common Stock,16.97,-0.51,-0.03,Medium,United States,285071,Health Care,4837654.87,TRUE,$950160.KQ $ABBV $AMGN $SPY
GMTX,Gemini Therapeutics Inc. Common Stock,13.26,-0.29,-0.02,Medium,United States,364655,Health Care,4835325.3,TRUE,$950160.KQ $ABBV $AMGN $SPY
AGX,Argan Inc. Common Stock,54.63,1.28,0.02,Medium,United States,88296,Basic Industries,4823610.48,TRUE,$PWR $ACM $MTZ $SPY
GTY,Getty Realty Corporation Common Stock,28.82,0.5,0.02,Medium,United States,167139,Finance,4816945.98,TRUE,$SPG $O $REG $SPY
IMKTA,Ingles Markets Incorporated Class A Common Stock,62.33,0.68,0.01,Medium,United States,77241,Consumer Services,4814431.53,TRUE,$KR $ACI $CASY $SPY
GFF,Griffon Corporation Common Stock,27.8,0.63,0.02,Medium,United States,172638,Capital Goods,4799336.4,TRUE,$CARR $MAS $FBHS $SPY
SVFA,SVF Investment Corp. Class A Ordinary Shares,10.42,0.21,0.02,Medium,United States,459612,Finance,4789157.04,TRUE,$SPY $DIA $IWM $QQQ
LKCO,Luokung Technology Corp Ordinary Shares,1.31,0.01,0.01,Medium,China,3653407,Technology,4785963.17,TRUE,$700.HK $1024.HK $BIDU $SPY
OSW,OneSpaWorld Holdings Limited Common Shares,11.28,0.63,0.06,Medium,Bahamas,423251,Consumer Services,4774271.28,TRUE,$OSW $SPY
IDYA,IDEAYA Biosciences Inc. Common Stock,23.84,0.34,0.01,Medium,United States,200116,Health Care,4770765.44,FALSE,$950160.KQ $ABBV $AMGN $SPY
SXI,Standex International Corporation Common Stock,94.6,-0.97,-0.01,Medium,United States,50391,Technology,4766988.6,TRUE,$ITW $PH $SWK $SPY
PMVP,PMV Pharmaceuticals Inc. Common Stock,32.94,0.05,0,Medium,United States,144515,Health Care,4760324.1,TRUE,$950160.KQ $ABBV $AMGN $SPY
PRDO,Perdoceo Education Corporation Common Stock,12.45,0.49,0.04,Medium,United States,381856,Consumer Services,4754107.2,TRUE,$CHGG $BFAM $LOPE $SPY
DNOW,NOW Inc. Common Stock,10.47,0.38,0.04,Medium,,453624,Energy,4749443.28,TRUE,$FAST $URI $GWW $SPY
KNTE,Kinnate Biopharma Inc. Common Stock,31.12,-0.04,0,Medium,United States,152478,Health Care,4745115.36,TRUE,$950160.KQ $ABBV $AMGN $SPY
DCO,Ducommun Incorporated Common Stock,62.25,2.25,0.04,Medium,United States,76038,Capital Goods,4733365.5,TRUE,$BA $RTX $LMT $SPY
APTS,Preferred Apartment Communities Inc. Common Stock,10.35,0.5,0.05,Medium,United States,457060,Consumer Services,4730571,TRUE,$EQR $AVB $INVH $SPY
CUBI,Customers Bancorp Inc Common Stock,32.02,0.2,0.01,Medium,United States,147693,Finance,4729129.86,TRUE,$TFC $PNC $FRC $SPY
JWS,Jaws Acquisition Corp. Class A Ordinary Shares,13.42,0.17,0.01,Medium,,352191,Health Care,4726403.22,TRUE,$SPY $DIA $IWM $QQQ
NTST,NetSTREIT Corp. Common Stock,18.4,-0.09,0,Medium,United States,256821,Consumer Services,4725506.4,TRUE,$SPG $O $REG $SPY
DBD,Diebold Nixdorf Incorporated Common Stock,14.19,0.06,0,Medium,United States,332911,Miscellaneous,4724007.09,TRUE,$AAPL $DELL $HPQ $SPY
CRNX,Crinetics Pharmaceuticals Inc. Common Stock,16,0.72,0.05,Medium,United States,295048,Health Care,4720768,TRUE,$950160.KQ $ABBV $AMGN $SPY
FFIC,Flushing Financial Corporation Common Stock,20.97,-0.26,-0.01,Medium,United States,224563,Finance,4709086.11,TRUE,$TFC $PNC $FRC $SPY
RMNI,Rimini Street Inc. (DE) Common Stock,9.01,0.04,0,Medium,United States,521293,Miscellaneous,4696849.93,TRUE,$ADBE $CRM $INTU $SPY
OR,Osisko Gold Royalties Ltd Common Shares,11.46,0.44,0.04,Medium,,408917,Basic Industries,4686188.82,TRUE,$ABX.TO $FNV.TO $WPM.TO $SPY
MTSC,MTS Systems Corporation Common Stock,58.29,0.09,0,Medium,United States,80322,Capital Goods,4681969.38,TRUE,$KEYS $ZBRA $TRMB $SPY
ASPN,Aspen Aerogels Inc. Common Stock,20.79,0.45,0.02,Medium,United States,224235,Consumer Services,4661845.65,TRUE,$SLB $BKR $HAL $SPY
HVT,Haverty Furniture Companies Inc. Common Stock,37.9,0.71,0.02,Medium,United States,122977,Consumer Services,4660828.3,TRUE,$WSM $RH $SNBR $SPY
MATW,Matthews International Corporation Class A Common Stock,41.14,1.59,0.04,Medium,United States,113278,Capital Goods,4660256.92,TRUE,$CTAS $CPRT $IAA $SPY
CBB,Cincinnati Bell Inc. Common Stock,15.36,0.01,0,Medium,United States,303122,Public Utilities,4655953.92,TRUE,$VZ $T $RADI $SPY
PNTG,The Pennant Group Inc. Common Stock ,46.03,0.23,0.01,Medium,United States,101114,Health Care,4654277.42,TRUE,$HCA $UHS $EHC $SPY
AFYA,Afya Limited Class A Common Shares,19.5,0.91,0.05,Medium,Brazil,238668,Consumer Services,4654026,TRUE,$CSED3.SA $YDUQ3.SA $COGN3.SA $SPY
NXE,Nexgen Energy Ltd. Common Shares,3.8,0.17,0.05,Medium,,1223129,Basic Industries,4647890.2,TRUE,$CCO.TO $NXE.TO $DML.TO $SPY
TRS,TriMas Corporation Common Stock,30.57,0.25,0.01,Medium,United States,151937,Capital Goods,4644714.09,TRUE,$ITW $PH $SWK $SPY
AAN,Aarons Holdings Company Inc. Common Stock ,26.01,0.33,0.01,Medium,United States,178563,Technology,4644423.63,FALSE,$WSM $RH $SNBR $SPY
TNC,Tennant Company Common Stock,80.65,0.76,0.01,Medium,United States,57574,Technology,4643343.1,TRUE,$ITW $PH $SWK $SPY
KNL,Knoll Inc. Common Stock,16.56,0.05,0,Medium,United States,279776,Consumer Durables,4633090.56,TRUE,$MSA $MLHR $HNI $SPY
LPG,Dorian LPG Ltd. Common Stock,13.06,-0.07,-0.01,Medium,,354200,Transportation,4625852,TRUE,$EPD $KMI $WMB $SPY
DMRC,Digimarc Corporation Common Stock,31.13,1.47,0.05,Medium,United States,148513,Technology,4623209.69,TRUE,$ADBE $CRM $INTU $SPY
PGEN,Precigen Inc. Common Stock,6.99,0.1,0.01,Medium,United States,660889,Health Care,4619614.11,TRUE,$950160.KQ $ABBV $AMGN $SPY
IBIO,iBio Inc. Common Stock,1.63,0.09,0.06,Medium,United States,2831273,Health Care,4614974.99,FALSE,$950160.KQ $ABBV $AMGN $SPY
BNFT,Benefitfocus Inc. Common Stock,13.91,0.1,0.01,Medium,United States,330770,Technology,4601010.7,TRUE,$ADBE $CRM $INTU $SPY
FARO,FARO Technologies Inc. Common Stock,88.22,1.65,0.02,Medium,United States,52138,Capital Goods,4599614.36,TRUE,$KEYS $ZBRA $TRMB $SPY
SPNV,Supernova Partners Acquisition Company Inc. Class A Common Stock,10.11,0,0,Medium,United States,453712,Finance,4587028.32,TRUE,$SPY $DIA $IWM $QQQ
FC,Franklin Covey Company Common Stock,29.35,1.06,0.04,Medium,United States,155974,Consumer Services,4577836.9,TRUE,$950140.KQ $CSGP $VRSK $SPY
SBSI,Southside Bancshares Inc. Common Stock,38.5,-0.01,0,Medium,United States,118734,Finance,4571259,TRUE,$TFC $PNC $FRC $SPY
LIND,Lindblad Expeditions Holdings Inc. Common Stock,18.01,-0.89,-0.05,Medium,United States,252875,Consumer Services,4554278.75,TRUE,$ABNB $MAR $HLT $SPY
NXRT,NexPoint Residential Trust Inc. Common Stock,46.62,0.53,0.01,Medium,United States,97337,Consumer Services,4537850.94,TRUE,$EQR $AVB $INVH $SPY
CMO,Capstead Mortgage Corporation Common Stock,6.35,0.12,0.02,Medium,United States,711112,Consumer Services,4515561.2,TRUE,$NLY $AGNC $STWD $SPY
KREF,KKR Real Estate Finance Trust Inc. Common Stock,18.7,0.31,0.02,Medium,United States,240958,Consumer Services,4505914.6,TRUE,$NLY $AGNC $STWD $SPY
WLDN,Willdan Group Inc. Common Stock,42.55,1.5,0.04,Medium,United States,105837,Consumer Services,4503364.35,TRUE,$950140.KQ $CSGP $VRSK $SPY
GPMT,Granite Point Mortgage Trust Inc. Common Stock,12.17,0.2,0.02,Medium,,369186,Consumer Services,4492993.62,FALSE,$NLY $AGNC $STWD $SPY
PLYA,Playa Hotels & Resorts N.V. Ordinary Shares,7.32,0.02,0,Medium,Netherlands,613675,Consumer Services,4492101,TRUE,$PLYA $PPH.L $SPY
TTI,Tetra Technologies Inc. Common Stock,2.8,0.4,0.17,Medium,United States,1603869,Energy,4490833.2,TRUE,$SLB $BKR $HAL $SPY
EFSC,Enterprise Financial Services Corporation Common Stock,49.58,0.14,0,Medium,United States,90492,Finance,4486593.36,TRUE,$TFC $PNC $FRC $SPY
AWH,Aspira Women's Health Inc. Common Stock,6.84,0.09,0.01,Medium,United States,652406,Health Care,4462457.04,TRUE,$ABT $DHR $SYK $SPY
CHCT,Community Healthcare Trust Incorporated Common Stock,48.03,1.91,0.04,Medium,United States,92873,Consumer Services,4460690.19,TRUE,$WELL $VTR $PEAK $SPY
NTB,Bank of N.T. Butterfield & Son Limited (The) Voting Ordinary Shares,37.97,-0.25,-0.01,Medium,Bermuda,117306,Finance,4454108.82,TRUE,$NTB $SPY
BCOV,Brightcove Inc. Common Stock,21.29,1.17,0.06,Medium,United States,209195,Technology,4453761.55,TRUE,$SNOW $TWLO $OKTA $SPY
CTS,CTS Corporation Common Stock,31.66,0.6,0.02,Medium,United States,140407,Technology,4445285.62,TRUE,$IPGP $JBL $SANM $SPY
YMAB,Y-mAbs Therapeutics Inc. Common Stock,30.28,0.04,0,Medium,United States,146535,Health Care,4437079.8,TRUE,$950160.KQ $ABBV $AMGN $SPY
NBLX,Noble Midstream Partners LP Common Units Representing Limited Partner Interests,14.7,0.2,0.01,Medium,United States,301751,Energy,4435739.7,TRUE,$EPD $KMI $WMB $SPY
PDAC,Peridot Acquisition Corp. Class A Ordinary Shares,10.71,0.06,0.01,Medium,United States,413732,Finance,4431069.72,TRUE,$SPY $DIA $IWM $QQQ
PETQ,PetIQ Inc. Class A Common Stock,35.38,0.12,0,Medium,United States,124543,Health Care,4406331.34,FALSE,$MCK $ABC $CAH $SPY
WMK,Weis Markets Inc. Common Stock,56.88,0.36,0.01,Medium,United States,77382,Consumer Services,4401488.16,TRUE,$KR $ACI $CASY $SPY
AFIN,American Finance Trust Inc. Class A Common Stock,9.87,0.05,0.01,Medium,United States,445388,Consumer Services,4395979.56,TRUE,$SPG $O $REG $SPY
BHE,Benchmark Electronics Inc. Common Stock,31.35,0.43,0.01,Medium,United States,140088,Technology,4391758.8,TRUE,$IPGP $JBL $SANM $SPY
LKFN,Lakeland Financial Corporation Common Stock,69.43,0.24,0,Medium,United States,63140,Finance,4383810.2,TRUE,$TFC $PNC $FRC $SPY
MGRC,McGrath RentCorp Common Stock,81.99,1.34,0.02,Medium,United States,53440,Technology,4381545.6,TRUE,$FAST $URI $GWW $SPY
BRBR,BellRing Brands Inc. Class A Common Stock,24.2,0.59,0.03,Medium,United States,181032,Consumer Non-Durables,4380974.4,TRUE,$EL $COTY $NUS $SPY
CNTY,Century Casinos Inc. Common Stock,11.26,0.99,0.1,Medium,United States,388876,Consumer Services,4378743.76,FALSE,$LVS $DKNG $MGM $SPY
MSB,Mesabi Trust Common Stock,31.88,1.8,0.06,Medium,United States,137316,Basic Industries,4377634.08,TRUE,$NUE $STLD $RS $SPY
ARGO,Argo Group International Holdings Ltd.,51.29,0.97,0.02,Medium,Bermuda,85090,Finance,4364266.1,TRUE,$ACGL $AXS $AGO $SPY
HMST,HomeStreet Inc. Common Stock,43.72,-0.35,-0.01,Medium,United States,99778,Finance,4362294.16,TRUE,$RKT $PCSO $UWMC $SPY
GOSS,Gossamer Bio Inc. Common Stock,9.35,0.1,0.01,Medium,United States,465445,Health Care,4351910.75,TRUE,$950160.KQ $ABBV $AMGN $SPY
KRON,Kronos Bio Inc. Common Stock,28.51,-0.76,-0.03,Medium,United States,152378,Health Care,4344296.78,TRUE,$950160.KQ $ABBV $AMGN $SPY
EGBN,Eagle Bancorp Inc. Common Stock,54.12,0.91,0.02,Medium,United States,80151,Finance,4337772.12,TRUE,$TFC $PNC $FRC $SPY
IPI,Intrepid Potash Inc Common Stock,32.86,0.3,0.01,Medium,United States,131947,Basic Industries,4335778.42,FALSE,$CTVA $FMC $SMG $SPY
MCRI,Monarch Casino & Resort Inc. Common Stock,62.57,1.95,0.03,Medium,United States,69229,Consumer Services,4331658.53,TRUE,$LVS $DKNG $MGM $SPY
DGII,Digi International Inc. Common Stock,19.36,0.37,0.02,Medium,United States,223297,Technology,4323029.92,TRUE,$CSCO $MSI $ANET $SPY
VEI,Vine Energy Inc. Class A Common Stock,13.41,-0.33,-0.02,Medium,,322279,Energy,4321761.39,TRUE,$COP $EOG $PXD $SPY
MOV,Movado Group Inc. Common Stock,27.9,-0.55,-0.02,Medium,United States,154483,Consumer Non-Durables,4310075.7,TRUE,$VFC $MAJJ $TPR $SPY
SNEX,StoneX Group Inc. Common Stock,65.8,0.42,0.01,Medium,United States,65482,Finance,4308715.6,TRUE,$MS $SCHW $GS $SPY
SRDX,Surmodics Inc. Common Stock,56.18,0.11,0,Medium,United States,76676,Health Care,4307657.68,TRUE,$ABT $DHR $SYK $SPY
ERII,Energy Recovery Inc. Common Stock,19.13,0.79,0.04,Medium,United States,225140,Technology,4306928.2,TRUE,$ITW $PH $SWK $SPY
WABC,Westamerica Bancorporation Common Stock,63.31,0.53,0.01,Medium,United States,67991,Finance,4304510.21,TRUE,$TFC $PNC $FRC $SPY
GEL,Genesis Energy L.P. Common Units,9.4,0.06,0.01,Medium,United States,457559,Energy,4301054.6,TRUE,$EPD $KMI $WMB $SPY
SYKE,Sykes Enterprises Incorporated Common Stock,44.58,0.5,0.01,Medium,United States,96360,Technology,4295728.8,TRUE,$V $MA $PYPL $SPY
FIXX,Homology Medicines Inc. Common Stock,9.62,0.21,0.02,Medium,United States,445207,Health Care,4282891.34,TRUE,$950160.KQ $ABBV $AMGN $SPY
WETF,WisdomTree Investments Inc. Common Stock,6.45,0.2,0.03,Medium,United States,659958,Finance,4256729.1,TRUE,$BLK $BX $KKR $SPY
FUSE,Fusion Acquisition Corp. Class A Common Stock,9.92,-0.04,0,Medium,United States,428780,Finance,4253497.6,TRUE,$SPY $DIA $IWM $QQQ
ORIC,Oric Pharmaceuticals Inc. Common Stock,23.22,-1.28,-0.05,Medium,United States,183091,Health Care,4251373.02,TRUE,$950160.KQ $ABBV $AMGN $SPY
CIR,CIRCOR International Inc. Common Stock,35.37,0.55,0.02,Medium,United States,120027,Capital Goods,4245354.99,TRUE,$ITW $PH $SWK $SPY
JG,Aurora Mobile Limited American Depositary Shares,4.3,0.07,0.02,Medium,China,984038,Technology,4231363.4,FALSE,$688111.SS $600588.SS $002230.SZ $SPY
AVO,Mission Produce Inc. Common Stock,19.16,0.15,0.01,Medium,United States,220440,Consumer Non-Durables,4223630.4,TRUE,$MDLZ $KHC $GIS $SPY
RPT,RPT Realty Common Stock,11.78,0.37,0.03,Medium,United States,358380,Consumer Services,4221716.4,TRUE,$SPG $O $REG $SPY
NXGN,NextGen Healthcare Inc. Common Stock,18.67,0.57,0.03,Medium,United States,225996,Technology,4219345.32,TRUE,$VEEV $TDOC $CERN $SPY
EQOS,Diginex Limited Ordinary Shares,11.39,0.42,0.04,Medium,Singapore,370109,Finance,4215541.51,TRUE,$388.HK $EQOS $8317.HK $SPY
KFRC,Kforce Inc. Common Stock,54.29,0.69,0.01,Medium,United States,77630,Technology,4214532.7,TRUE,$RHI $UPWK $MAN $SPY
BRKL,Brookline Bancorp Inc. Common Stock,15.05,0.05,0,Medium,United States,279858,Finance,4211862.9,TRUE,$TFC $PNC $FRC $SPY
AXTI,AXT Inc Common Stock,12.31,0.65,0.06,Medium,United States,341811,Technology,4207693.41,TRUE,$AMAT $LRCX $KLAC $SPY
GLDD,Great Lakes Dredge & Dock Corporation Common Stock,15,0.42,0.03,Medium,United States,280475,Basic Industries,4207125,TRUE,$PWR $ACM $MTZ $SPY
BHLB,Berkshire Hills Bancorp Inc. Common Stock,22.4,0.08,0,Medium,United States,187738,Finance,4205331.2,TRUE,$TFC $PNC $FRC $SPY
CIO,City Office REIT Inc. Common Stock,11.3,0.68,0.06,Medium,,371941,Consumer Services,4202933.3,TRUE,$AP.UN.TO $D.UN.TO $TNT.UN.TO $SPY
KOP,Koppers Holdings Inc. Koppers Holdings Inc. Common Stock,34.63,-0.13,0,Medium,United States,120817,Basic Industries,4183892.71,TRUE,$DOW $WLK $OLN $SPY
MREO,Mereo BioPharma Group plc American Depositary Shares,3.38,0.01,0,Medium,United Kingdom,1234518,Health Care,4172670.84,TRUE,$GNS.L $ABC.L $MYOV $SPY
CLNC,Colony Credit Real Estate Inc. Class A Common Stock,8.6,0.08,0.01,Medium,,484248,Consumer Services,4164532.8,TRUE,$NLY $AGNC $STWD $SPY
SNCY,Sun Country Airlines Holdings Inc. Common Stock,33.5,-0.78,-0.02,Medium,United States,124181,Transportation,4160063.5,TRUE,$SPY $DIA $IWM $QQQ
ATRI,Atrion Corporation Common Stock,643.4,2.09,0,Medium,United States,6464,Health Care,4158937.6,TRUE,$950130.KQ $ALGN $WST $SPY
MIRM,Mirum Pharmaceuticals Inc. Common Stock,20.6,0.78,0.04,Medium,United States,201574,Health Care,4152424.4,TRUE,$950160.KQ $ABBV $AMGN $SPY
LNN,Lindsay Corporation Common Stock,167.4,0.78,0,Medium,United States,24797,Capital Goods,4151017.8,TRUE,$DE $TTC $AGCO $SPY
REVG,REV Group Inc. Common Stock,19.23,0.07,0,Medium,United States,215803,Capital Goods,4149891.69,TRUE,$CAT $CMI $PCAR $SPY
ARCO,Arcos Dorados Holdings Inc. Class A Shares,5.14,0.05,0.01,Medium,Argentina,807144,Consumer Services,4148720.16,TRUE,$ARCO $SPY
BCOR,Blucora Inc. Common Stock,17.05,0.41,0.02,Medium,United States,242999,Finance,4143132.95,TRUE,$BLK $BX $KKR $SPY
FOE,Ferro Corporation Common Stock,16.99,0.13,0.01,Medium,United States,243652,Basic Industries,4139647.48,TRUE,$SHW $ECL $DD $SPY
GOOD,Gladstone Commercial Corporation Real Estate Investment Trust,20.05,0.49,0.03,Medium,United States,206095,Consumer Services,4132204.75,TRUE,$WPC $VER $STOR $SPY
FMAC,FirstMark Horizon Acquisition Corp. Class A Common Stock,9.96,-0.04,0,Medium,United States,414464,Finance,4128061.44,TRUE,$SPY $DIA $IWM $QQQ
APOG,Apogee Enterprises Inc. Common Stock,41.37,0.49,0.01,Medium,United States,99372,Capital Goods,4111019.64,TRUE,$CARR $MAS $FBHS $SPY
VOXX,VOXX International Corporation Class A Common Stock,19.81,0.75,0.04,Medium,United States,207210,Technology,4104830.1,TRUE,$SONO $GPRO $VUZI $SPY
AOUT,American Outdoor Brands Inc. Common Stock ,26.07,0.87,0.03,Medium,United States,157184,Capital Goods,4097786.88,TRUE,$PTON $HAS $PII $SPY
MRTN,Marten Transport Ltd. Common Stock,17.21,0.24,0.01,Medium,United States,237969,Transportation,4095446.49,TRUE,$UBER $ODFL $LYFT $SPY
SELB,Selecta Biosciences Inc. Common Stock,4.53,0.01,0,Medium,United States,903685,Health Care,4093693.05,TRUE,$950160.KQ $ABBV $AMGN $SPY
VKTX,Viking Therapeutics Inc. Common Stock,6.28,-0.05,-0.01,Medium,United States,649677,Health Care,4079971.56,TRUE,$950160.KQ $ABBV $AMGN $SPY
LMAT,LeMaitre Vascular Inc. Common Stock,48.58,-0.2,0,Medium,United States,83965,Health Care,4079019.7,TRUE,$ABT $DHR $SYK $SPY
LORL,Loral Space and Communications Inc. Common Stock,38.32,0.65,0.02,Medium,United States,106333,Technology,4074680.56,TRUE,$CMCSA $CHTR $LBRDA $SPY
MMI,Marcus & Millichap Inc. Common Stock,34.21,0.51,0.02,Medium,,118779,Finance,4063429.59,TRUE,$CBRE $OPEN $JLL $SPY
BVS,Bioventus Inc. Class A Common Stock,15.23,-0.05,0,Medium,United States,266285,Health Care,4055520.55,TRUE,$SPY $DIA $IWM $QQQ
OUST,Ouster Inc. Common Stock,8.75,0.25,0.03,Medium,United States,462920,Capital Goods,4050550,TRUE,$SPY $DIA $IWM $QQQ
SPNT,SiriusPoint Ltd. Common Shares,10.32,0.15,0.01,Medium,,391216,Finance,4037349.12,TRUE,$RE $RNR $ESGR $SPY
ALGS,Aligos Therapeutics Inc. Common Stock,22,-0.74,-0.03,Medium,United States,183444,Health Care,4035768,TRUE,$950160.KQ $ABBV $AMGN $SPY
CSV,Carriage Services Inc. Common Stock,36.14,0.95,0.03,Medium,United States,111371,Consumer Services,4024947.94,TRUE,$SCI $TMX $FTDR $SPY
SNR,New Senior Investment Group Inc. Common Stock,6.46,0.23,0.04,Medium,United States,620623,Consumer Services,4009224.58,TRUE,$WELL $VTR $PEAK $SPY
MUX,McEwen Mining Inc. Common Stock,1.09,0.05,0.05,Medium,Canada,3677330,Basic Industries,4008289.7,TRUE,$ABX.TO $FNV.TO $WPM.TO $SPY
SOAC,Sustainable Opportunities Acquisition Corp. Class A Ordinary Shares,9.94,0.01,0,Medium,,403111,Finance,4006923.34,TRUE,$SPY $DIA $IWM $QQQ
PACE,TPG Pace Tech Opportunities Corp. Class A Ordinary Shares,9.96,0.05,0.01,Medium,United States,402211,Finance,4006021.56,TRUE,$SPY $DIA $IWM $QQQ
FSSI,Fortistar Sustainable Solutions Corp. Class A Common Stock,9.85,0.14,0.01,Medium,United States,406490,Finance,4003926.5,TRUE,$SPY $DIA $IWM $QQQ
ATRO,Astronics Corporation Common Stock,18.24,0.2,0.01,Medium,United States,218893,Capital Goods,3992608.32,TRUE,$BA $RTX $LMT $SPY
SVM,Silvercorp Metals Inc. Common Shares,5.14,0.23,0.05,Medium,,776465,Basic Industries,3991030.1,TRUE,$PAAS.TO $FR.TO $MAG.TO $SPY
BUSE,First Busey Corporation Class A Common Stock,25.8,0.15,0.01,Medium,United States,154592,Finance,3988473.6,TRUE,$TFC $PNC $FRC $SPY
JBSS,John B. Sanfilippo & Son Inc. Common Stock,90.42,0.05,0,Medium,United States,44108,Consumer Non-Durables,3988245.36,TRUE,$MDLZ $KHC $GIS $SPY
ZIXI,Zix Corporation Common Stock,7.74,0.19,0.03,Medium,United States,514138,Technology,3979428.12,TRUE,$ADBE $CRM $INTU $SPY
HTLD,Heartland Express Inc. Common Stock,19.66,0.08,0,Medium,United States,201780,Transportation,3966994.8,TRUE,$UBER $ODFL $LYFT $SPY
AUTL,Autolus Therapeutics plc American Depositary Share,5.91,0.18,0.03,Medium,United Kingdom,670052,Health Care,3960007.32,TRUE,$GNS.L $ABC.L $MYOV $SPY
RYAM,Rayonier Advanced Materials Inc. Common Stock,9.46,0.39,0.04,Medium,United States,417572,Basic Industries,3950231.12,TRUE,$SHW $ECL $DD $SPY
QADA,QAD Inc. Class A Common Stock,70,3.42,0.05,Medium,United States,56371,Technology,3945970,TRUE,$ADBE $CRM $INTU $SPY
STIM,Neuronetics Inc. Common Stock,12.51,0.14,0.01,Medium,United States,315095,Health Care,3941838.45,TRUE,$ABT $DHR $SYK $SPY
ZEPP,Zepp Health Corporation American Depositary Shares,11.45,0.68,0.06,Medium,China,344102,Technology,3939967.9,TRUE,$002415.SZ $002236.SZ $002414.SZ $SPY
VYGG,Vy Global Growth Class A Ordinary Shares,10.16,0.04,0,Medium,Cayman Islands,387232,Finance,3934277.12,TRUE,$SPY $DIA $IWM $QQQ
WOW,WideOpenWest Inc. Common Stock,13.58,-0.01,0,Medium,United States,289173,Consumer Services,3926969.34,TRUE,$CMCSA $CHTR $LBRDA $SPY
FBIO,Fortress Biotech Inc. Common Stock,3.85,0.32,0.09,Medium,United States,1019824,Health Care,3926322.4,TRUE,$950160.KQ $ABBV $AMGN $SPY
RYI,Ryerson Holding Corporation Common Stock,16.75,-0.29,-0.02,Medium,United States,232936,Basic Industries,3901678,TRUE,$NUE $STLD $RS $SPY
CMRE,Costamare Inc. Common Stock $0.0001 par value,9.88,0.26,0.03,Medium,Greece,394782,Transportation,3900446.16,TRUE,$CMRE $NMCI $NMM $SPY
NP,Neenah Inc. Common Stock,52.02,0.64,0.01,Medium,United States,74859,Basic Industries,3894165.18,TRUE,$UFS $SWM $NP $SPY
NBEV,NewAge Inc. Common Stock,2.92,0.06,0.02,Medium,United States,1332750,Consumer Non-Durables,3891630,FALSE,$KO $PEP $KDP $SPY
TRUE,TrueCar Inc. Common Stock,5.06,0.28,0.06,Medium,United States,765468,Technology,3873268.08,TRUE,$GOOGL $FB $SNAP $SPY
TILE,Interface Inc. Common Stock,12.71,0.23,0.02,Medium,United States,304689,Consumer Durables,3872597.19,TRUE,$MSA $MLHR $HNI $SPY
HLIT,Harmonic Inc. Common Stock,7.92,0.08,0.01,Medium,United States,488285,Technology,3867217.2,TRUE,$CSCO $MSI $ANET $SPY
VRAY,ViewRay Inc. Common Stock,4.41,0.06,0.01,Medium,United States,876041,Health Care,3863340.81,TRUE,$ABT $DHR $SYK $SPY
