Symbol,Name,Last Sale,Net Change,% Change,Market Cap,Country,Volume,Sector,Price x Volume,Smooth Test,Peers
VCTR,Victory Capital Holdings Inc. Class A Common Stock,25.89,0.33,0.01,Medium,United States,101103,Finance,2617556.67,TRUE,$BLK $BX $KKR $SPY
OFIX,Orthofix Medical Inc. Common Stock (DE),42.93,-0.42,-0.01,Medium,Curacao,60948,Health Care,2616497.64,TRUE,$ABT $DHR $SYK $SPY
NTUS,Natus Medical Incorporated Common Stock,26,0.39,0.02,Medium,United States,100208,Health Care,2605408,TRUE,$ABT $DHR $SYK $SPY
BDSX,Biodesix Inc. Common Stock,20.28,-0.03,0,Medium,United States,128259,Health Care,2601092.52,TRUE,$CVS $CI $LH $SPY
LEU,Centrus Energy Corp. Class A Common Stock,24.03,0.31,0.01,Medium,United States,107956,Basic Industries,2594182.68,TRUE,$EVA $EFR.TO $ARLP $SPY
FMBH,First Mid Bancshares Inc. Common Stock,44.02,0.09,0,Medium,United States,58930,Finance,2594098.6,TRUE,$TFC $PNC $FRC $SPY
COGT,Cogent Biosciences Inc. Common Stock,9.08,0.3,0.03,Medium,United States,284073,Health Care,2579382.84,FALSE,$950160.KQ $ABBV $AMGN $SPY
HT,Hersha Hospitality Trust Class A Common Shares of Beneficial Interest,10.75,0.2,0.02,Medium,United States,239799,Consumer Services,2577839.25,TRUE,$MGP $HST $PK $SPY
YPF,YPF Sociedad Anonima Common Stock,4.24,0.13,0.03,Medium,Argentina,605077,Energy,2565526.48,TRUE,$YPFD3.BA $SPY
RLMD,Relmada Therapeutics Inc. Common Stock,36.65,1.44,0.04,Medium,United States,69493,Health Care,2546918.45,TRUE,$JNJ $PFE $MRK $SPY
URGN,UroGen Pharma Ltd. Ordinary Shares,19.63,0.15,0.01,Medium,Israel,129707,Health Care,2546148.41,TRUE,$BONS.TA $KMDA.TA $EVGN.TA $SPY
CRVL,CorVel Corp. Common Stock,104.61,2.02,0.02,Medium,United States,24327,Finance,2544847.47,TRUE,$CVS $CI $LH $SPY
GPRK,Geopark Ltd Common Shares,16.75,0.75,0.05,Medium,Bermuda,151386,Energy,2535715.5,TRUE,$GPRK $SPY
CASA,Casa Systems Inc. Common Stock,9.8,0.27,0.03,Medium,United States,257895,Technology,2527371,TRUE,$CSCO $MSI $ANET $SPY
PGC,Peapack-Gladstone Financial Corporation Common Stock,31.17,0.29,0.01,Medium,United States,81061,Finance,2526671.37,TRUE,$TFC $PNC $FRC $SPY
AXU,Alexco Resource Corp Common Shares (Canada),2.61,0.1,0.04,Medium,Canada,967895,Basic Industries,2526205.95,TRUE,$WCN.TO $GFL.TO $PYR.TO $SPY
PACK,Ranpak Holdings Corp Class A Common Stock,20.3,0.24,0.01,Medium,,124442,Consumer Durables,2526172.6,TRUE,$IP $AVY $WRK $SPY
TPCO,Tribune Publishing Company Common Stock,18.03,0.04,0,Medium,United States,140100,Consumer Services,2526003,TRUE,$NWSA $NYT $JW.A $SPY
ANIP,ANI Pharmaceuticals Inc.,34.03,-2.11,-0.06,Medium,United States,74074,Health Care,2520738.22,TRUE,$JNJ $PFE $MRK $SPY
TLYS,Tilly's Inc. Common Stock,11.23,-0.09,-0.01,Medium,United States,224359,Consumer Services,2519551.57,TRUE,$TJX $ROST $BURL $SPY
KBAL,Kimball International Inc. Class B Common Stock,13.95,-0.05,0,Medium,United States,180557,Consumer Durables,2518770.15,TRUE,$MSA $MLHR $HNI $SPY
ANDE,Andersons Inc. (The) Common Stock,27.58,0.2,0.01,Medium,United States,91188,Consumer Services,2514965.04,TRUE,$SYY $USFD $PFGC $SPY
PEBO,Peoples Bancorp Inc. Common Stock,33.14,-0.03,0,Medium,United States,75764,Finance,2510818.96,TRUE,$TFC $PNC $FRC $SPY
LBAI,Lakeland Bancorp Inc. Common Stock,17.33,-0.1,-0.01,Medium,United States,144696,Finance,2507581.68,TRUE,$TFC $PNC $FRC $SPY
GABC,German American Bancorp Inc. Common Stock,46.83,0.61,0.01,Medium,United States,53462,Finance,2503625.46,TRUE,$TFC $PNC $FRC $SPY
SCU,Sculptor Capital Management Inc. Class A Common Stock,22.21,0.33,0.02,Medium,United States,112619,Finance,2501267.99,TRUE,$BLK $BX $KKR $SPY
WINA,Winmark Corporation Common Stock,191.06,4.63,0.02,Medium,United States,13047,Consumer Services,2492759.82,TRUE,$TSCO $ULTA $FIVE $SPY
ACND,Ascendant Digital Acquisition Corp. Class A Ordinary Shares,9.9,0,0,Medium,United States,250671,Finance,2481642.9,TRUE,$SPY $DIA $IWM $QQQ
STBA,S&T Bancorp Inc. Common Stock,33.49,-0.01,0,Medium,United States,73611,Finance,2465232.39,TRUE,$TFC $PNC $FRC $SPY
LDL,Lydall Inc. Common Stock,33.6,-0.14,0,Medium,United States,73268,Capital Goods,2461804.8,TRUE,$ITW $PH $SWK $SPY
ACEL,Accel Entertainment Inc. ,10.98,0.05,0,Medium,United States,223925,Consumer Services,2458696.5,TRUE,$LVS $DKNG $MGM $SPY
SPRO,Spero Therapeutics Inc. Common Stock,14.28,-0.44,-0.03,Medium,United States,172067,Health Care,2457116.76,TRUE,$950160.KQ $ABBV $AMGN $SPY
NEXT,NextDecade Corporation Common Stock,2.63,-0.04,-0.02,Medium,United States,929268,Public Utilities,2443974.84,TRUE,$EPD $KMI $WMB $SPY
THRY,Thryv Holdings Inc. Common Stock,24.23,0.83,0.04,Medium,United States,100749,Consumer Services,2441148.27,TRUE,$OMC $IPG $ADV $SPY
ALBO,Albireo Pharma Inc. Common Stock,35.48,0.23,0.01,Medium,United States,68709,Health Care,2437795.32,FALSE,$950160.KQ $ABBV $AMGN $SPY
ARAY,Accuray Incorporated Common Stock,4.97,0.02,0,Medium,United States,490288,Health Care,2436731.36,TRUE,$ABT $DHR $SYK $SPY
AXGN,Axogen Inc. Common Stock,19.86,-0.4,-0.02,Medium,United States,122188,Health Care,2426653.68,TRUE,$ABT $DHR $SYK $SPY
FREE,Whole Earth Brands Inc. Class A Common Stock,13.44,0.4,0.03,Medium,United States,179113,Consumer Non-Durables,2407278.72,TRUE,$MDLZ $KHC $GIS $SPY
LHDX,Lucira Health Inc. Common Stock,11.45,-0.65,-0.05,Medium,United States,209997,Health Care,2404465.65,TRUE,$ABT $DHR $SYK $SPY
TCX,Tucows Inc. Class A Common Stock,79.41,1.91,0.02,Medium,Canada,30205,Technology,2398579.05,TRUE,$SHOP $TCX $CSTR.V $SPY
HFWA,Heritage Financial Corporation Common Stock,28.6,0.36,0.01,Medium,United States,83700,Finance,2393820,TRUE,$TFC $PNC $FRC $SPY
HBNC,Horizon Bancorp Inc. Common Stock,18.76,0.18,0.01,Medium,United States,127512,Finance,2392125.12,TRUE,$TFC $PNC $FRC $SPY
CRNT,Ceragon Networks Ltd. Ordinary Shares,3.81,0.04,0.01,Medium,Israel,626772,Technology,2388001.32,TRUE,$GILT.TA $RDWR $AUDC $SPY
QCRH,QCR Holdings Inc. Common Stock,47.98,0.76,0.02,Medium,United States,49607,Finance,2380143.86,TRUE,$TFC $PNC $FRC $SPY
HNGR,Hanger Inc. Common Stock,23.25,0.43,0.02,Medium,United States,102323,Health Care,2379009.75,TRUE,$HCA $UHS $EHC $SPY
ANNX,Annexon Inc. Common Stock,27.48,-0.36,-0.01,Medium,United States,86464,Health Care,2376030.72,TRUE,$950160.KQ $ABBV $AMGN $SPY
MNTK,Montauk Renewables Inc. Common Stock,12.12,0.04,0,Medium,United States,195666,Public Utilities,2371471.92,TRUE,$SPY $DIA $IWM $QQQ
PBFX,PBF Logistics LP Common Units representing limited partner interests,14.63,-0.09,-0.01,Medium,,161781,Energy,2366856.03,TRUE,$EPD $KMI $WMB $SPY
BMA,Banco Macro S.A.  ADR (representing Ten Class B Common Shares),13.18,-0.17,-0.01,Medium,Argentina,178960,Finance,2358692.8,TRUE,$BMA3.BA $GGAL3.BA $BRIO3.BA $SPY
CTBI,Community Trust Bancorp Inc. Common Stock,44.76,0.73,0.02,Medium,United States,52661,Finance,2357106.36,TRUE,$TFC $PNC $FRC $SPY
ALTA,Altabancorp Common Stock,42.45,0.41,0.01,Medium,United States,55365,Finance,2350244.25,FALSE,$TFC $PNC $FRC $SPY
INZY,Inozyme Pharma Inc. Common Stock,20.5,0.7,0.04,Medium,United States,114637,Health Care,2350058.5,TRUE,$950160.KQ $ABBV $AMGN $SPY
MTRX,Matrix Service Company Common Stock,13.7,0.59,0.05,Medium,United States,170262,Basic Industries,2332589.4,TRUE,$PWR $ACM $MTZ $SPY
WRLD,World Acceptance Corporation Common Stock,130.22,0.46,0,Medium,United States,17876,Finance,2327812.72,TRUE,$AXP $COF $DFS $SPY
IMCR,Immunocore Holdings plc American Depositary Shares,40.55,-2.02,-0.05,Medium,United Kingdom,57272,Health Care,2322379.6,TRUE,$GNS.L $ABC.L $MYOV $SPY
PHAT,Phathom Pharmaceuticals Inc. Common Stock,36.94,-0.62,-0.02,Medium,United States,62835,Health Care,2321124.9,TRUE,$JNJ $PFE $MRK $SPY
RAAC,Revolution Acceleration Acquisition Corp Class A Common Stock,10.16,0.02,0,Medium,United States,228380,Finance,2320340.8,TRUE,$SPY $DIA $IWM $QQQ
UTL,UNITIL Corporation Common Stock,46.48,0.79,0.02,Medium,United States,49822,Public Utilities,2315726.56,TRUE,$D $SRE $PEG $SPY
GSKY,GreenSky Inc. Class A Common Stock,6.34,0.15,0.02,Medium,United States,364898,Miscellaneous,2313453.32,TRUE,$V $MA $PYPL $SPY
FPI,Farmland Partners Inc. Common Stock,11.49,0.28,0.03,Medium,,201306,Consumer Services,2313005.94,TRUE,$AMT $CCI $EQIX $SPY
LEAP,Ribbit LEAP Ltd. Class A Ordinary Shares,11.14,0.14,0.01,Medium,United States,206797,Finance,2303718.58,TRUE,$SPY $DIA $IWM $QQQ
TRTX,TPG RE Finance Trust Inc. Common Stock,11.4,0.2,0.02,Medium,United States,201368,Consumer Services,2295595.2,TRUE,$NLY $AGNC $STWD $SPY
GMDA,Gamida Cell Ltd. Ordinary Shares,8.31,0.22,0.03,Medium,Israel,275476,Health Care,2289205.56,TRUE,$BONS.TA $KMDA.TA $EVGN.TA $SPY
RPLA,Replay Acquisition Corp. Ordinary Shares,9.48,-0.07,-0.01,Medium,,241175,Finance,2286339,TRUE,$SPY $DIA $IWM $QQQ
RGP,Resources Connection Inc. Common Stock,13.76,0.22,0.02,Medium,United States,165239,Miscellaneous,2273688.64,TRUE,$950140.KQ $CSGP $VRSK $SPY
RSVA,Rodgers Silicon Valley Acquisition Corp. Common Stock,14.07,0.76,0.06,Medium,United States,161513,Finance,2272487.91,TRUE,$SPY $DIA $IWM $QQQ
TLMD,SOC Telemed Inc. Class A Common Stock,6.11,-0.18,-0.03,Medium,United States,371455,Health Care,2269590.05,TRUE,$CVS $CI $LH $SPY
UFPT,UFP Technologies Inc. Common Stock,52.58,2.76,0.06,Medium,United States,42798,Health Care,2250318.84,TRUE,$IP $AVY $WRK $SPY
NFBK,Northfield Bancorp Inc. Common Stock (Delaware),15.95,0.03,0,Medium,United States,140920,Finance,2247674,TRUE,$RKT $PCSO $UWMC $SPY
THFF,First Financial Corporation Indiana Common Stock,45.35,0.34,0.01,Medium,United States,49519,Finance,2245686.65,TRUE,$TFC $PNC $FRC $SPY
XENE,Xenon Pharmaceuticals Inc. Common Shares,18.89,0.99,0.06,Medium,Canada,118851,Health Care,2245095.39,TRUE,$AUP.TO $ZYME $TRIL.TO $SPY
NCBS,Nicolet Bankshares Inc. Common Stock,84.73,1.27,0.02,Medium,United States,26484,Finance,2243989.32,TRUE,$TFC $PNC $FRC $SPY
GDEN,Golden Entertainment Inc. Common Stock,26.44,1.18,0.05,Medium,United States,84852,Consumer Services,2243486.88,TRUE,$LVS $DKNG $MGM $SPY
CCF,Chase Corporation Common Stock,120.2,3.81,0.03,Medium,United States,18639,Consumer Durables,2240407.8,TRUE,$SHW $ECL $DD $SPY
GNTY,Guaranty Bancshares Inc. Common Stock,37.59,0.84,0.02,Medium,United States,59384,Finance,2232244.56,TRUE,$TFC $PNC $FRC $SPY
LCTX,Lineage Cell Therapeutics Inc. Common Stock,2.46,0.11,0.05,Medium,United States,906530,Health Care,2230063.8,FALSE,$950160.KQ $ABBV $AMGN $SPY
CCO,Clear Channel Outdoor Holdings Inc. Common Stock,1.88,0.08,0.04,Medium,United States,1180309,Consumer Services,2218980.92,TRUE,$OMC $IPG $ADV $SPY
MBIN,Merchants Bancorp Common Stock,41.33,-0.61,-0.01,Medium,United States,53420,Finance,2207848.6,TRUE,$RKT $PCSO $UWMC $SPY
CLFD,Clearfield Inc. Common Stock,31.15,1.02,0.03,Medium,United States,70872,Public Utilities,2207662.8,TRUE,$CSCO $MSI $ANET $SPY
FNCH,Finch Therapeutics Group Inc. Common Stock,15.65,-0.5,-0.03,Medium,United States,140558,Health Care,2199732.7,TRUE,$SPY $DIA $IWM $QQQ
FWAA,Fifth Wall Acquisition Corp. I Class A Common Stock,10.05,0.05,0.01,Medium,United States,218793,Finance,2198869.65,TRUE,$SPY $DIA $IWM $QQQ
VRS,Verso Corporation Common Stock,14.76,0.17,0.01,Medium,United States,148268,Basic Industries,2188435.68,TRUE,$UFS $SWM $NP $SPY
NCMI,National CineMedia Inc. Common Stock,4.5,-0.12,-0.03,Medium,United States,486274,Consumer Services,2188233,TRUE,$OMC $IPG $ADV $SPY
OYST,Oyster Point Pharma Inc. Common Stock,18.56,0.28,0.02,Medium,United States,117886,Health Care,2187964.16,TRUE,$950160.KQ $ABBV $AMGN $SPY
VEC,Vectrus Inc. Common Stock,53.65,0.21,0,Medium,United States,40627,Consumer Services,2179638.55,TRUE,$BA $RTX $LMT $SPY
ALTM,Altus Midstream Company Class A Common Stock,54.07,1.6,0.03,Medium,United States,39878,Public Utilities,2156203.46,FALSE,$EPD $KMI $WMB $SPY
TLIS,Talis Biomedical Corporation Common Stock,12.92,0.07,0.01,Medium,United States,166657,Capital Goods,2153208.44,TRUE,$ABT $DHR $SYK $SPY
NFH,New Frontier Health Corporation Ordinary Shares,11.2,-0.1,-0.01,Medium,,191881,Health Care,2149067.2,TRUE,$708.HK $300015.SZ $000516.SZ $SPY
RBAC,RedBall Acquisition Corp. Class A Ordinary Shares,9.96,0.01,0,Medium,United States,215485,Finance,2146230.6,TRUE,$SPY $DIA $IWM $QQQ
VRCA,Verrica Pharmaceuticals Inc. Common Stock,15.33,0.18,0.01,Medium,United States,139977,Health Care,2145847.41,TRUE,$JNJ $PFE $MRK $SPY
VRA,Vera Bradley Inc. Common Stock,10.24,0.14,0.01,Medium,United States,209249,Consumer Non-Durables,2142709.76,TRUE,$VFC $MAJJ $TPR $SPY
SCSC,ScanSource Inc. Common Stock,30.51,0.56,0.02,Medium,United States,70141,Technology,2140001.91,TRUE,$CDW $ARW $SNX $SPY
MTA,Metalla Royalty & Streaming Ltd. Common Shares,9.21,0.33,0.04,Medium,,231714,Basic Industries,2134085.94,TRUE,$SIL.TO $OSK.TO $GGD.TO $SPY
UBX,Unity Biotechnology Inc. Common Stock,6.3,0.3,0.05,Medium,United States,338665,Health Care,2133589.5,FALSE,$950160.KQ $ABBV $AMGN $SPY
DRD,DRDGOLD Limited American Depositary Shares,9.76,0.3,0.03,Medium,South Africa,217323,Basic Industries,2121072.48,TRUE,$ANG.JO $GFI.JO $HAR.JO $SPY
TSC,TriState Capital Holdings Inc. Common Stock,23.32,0.26,0.01,Medium,United States,90942,Finance,2120767.44,TRUE,$TFC $PNC $FRC $SPY
PDFS,PDF Solutions Inc. Common Stock,18.53,0.75,0.04,Medium,United States,113612,Technology,2105230.36,TRUE,$AMAT $LRCX $KLAC $SPY
NEXI,NexImmune Inc. Common Stock,20.84,1.76,0.09,Medium,United States,100708,Health Care,2098754.72,TRUE,$950160.KQ $ABBV $AMGN $SPY
ACIU,AC Immune SA Common Stock,7.69,0.08,0.01,Medium,Switzerland,272918,Health Care,2098739.42,FALSE,$CRSP $IDIA.SW $ADCT $SPY
MLR,Miller Industries Inc. Common Stock,46.87,0.68,0.01,Medium,United States,44755,Capital Goods,2097666.85,TRUE,$CAT $CMI $PCAR $SPY
WASH,Washington Trust Bancorp Inc. Common Stock,51.99,0.36,0.01,Medium,United States,40063,Finance,2082875.37,TRUE,$TFC $PNC $FRC $SPY
RICK,RCI Hospitality Holdings Inc. Common Stock,62.92,-0.67,-0.01,Medium,United States,33103,Consumer Services,2082840.76,TRUE,$MTN $PLNT $SIX $SPY
RAPT,RAPT Therapeutics Inc. Common Stock,23,0.8,0.04,Medium,United States,90491,Health Care,2081293,TRUE,$950160.KQ $ABBV $AMGN $SPY
ITRN,Ituran Location and Control Ltd. Ordinary Shares,21.96,0.73,0.03,Medium,Israel,94475,Technology,2074671,TRUE,$GILT.TA $RDWR $AUDC $SPY
GLP,Global Partners LP Global Partners LP Common Units representing Limited Partner Interests,21.58,0.22,0.01,Medium,United States,96007,Energy,2071831.06,TRUE,$EPD $KMI $WMB $SPY
AMBC,Ambac Financial Group Inc. Common Stock,16.94,0.2,0.01,Medium,United States,122065,Finance,2067781.1,TRUE,$PGR $TRV $ALL $SPY
PDS,Precision Drilling Corporation Common Stock,23.2,1.59,0.07,Medium,Canada,88273,Energy,2047933.6,FALSE,$PD.TO $ESI.TO $PHX.TO $SPY
YRD,Yiren Digital Ltd. American Depositary Shares each representing two ordinary shares,4.46,-0.61,-0.12,Medium,China,458570,Finance,2045222.2,TRUE,$LU $2858.HK $600817.SS $SPY
BATRK,Liberty Media Corporation Series C Liberty Braves Common Stock,28.5,0.68,0.02,Medium,United States,71696,Consumer Services,2043336,TRUE,$DIS $NFLX $ROKU $SPY
TG,Tredegar Corporation Common Stock,15.37,0.36,0.02,Medium,United States,132732,Capital Goods,2040090.84,TRUE,$DOW $WLK $OLN $SPY
XOMA,XOMA Corporation Common Stock,40.64,-0.17,0,Medium,United States,50137,Health Care,2037567.68,TRUE,$950160.KQ $ABBV $AMGN $SPY
REV,Revlon Inc. New Common Stock,12.23,-0.1,-0.01,Medium,United States,166484,Consumer Non-Durables,2036099.32,TRUE,$EL $COTY $NUS $SPY
IDT,IDT Corporation Class B Common Stock,22.87,0.21,0.01,Medium,United States,88674,Public Utilities,2027974.38,TRUE,$VZ $T $RADI $SPY
ETAC,E.Merge Technology Acquisition Corp. Class A Common Stock,9.81,0.06,0.01,Medium,United States,206619,Finance,2026932.39,TRUE,$SPY $DIA $IWM $QQQ
CTO,CTO Realty Growth Inc. Common Stock,53.04,1.03,0.02,Medium,United States,38089,Consumer Services,2020240.56,TRUE,$WPC $VER $STOR $SPY
JFU,9F Inc. American Depositary Shares,1.82,-0.03,-0.02,Medium,China,1110017,Finance,2020230.94,TRUE,$700.HK $1024.HK $BIDU $SPY
NSSC,NAPCO Security Technologies Inc. Common Stock,36.07,1.24,0.04,Medium,United States,55887,Capital Goods,2015844.09,TRUE,$KEYS $ZBRA $TRMB $SPY
TOUR,Tuniu Corporation American Depositary Shares,3.64,0.18,0.05,Medium,China,550950,Consumer Services,2005458,TRUE,$1179.HK $600754.SS $600258.SS $SPY
WSR,Whitestone REIT Common Shares,9.7,0,0,Medium,United States,205893,Consumer Services,1997162.1,TRUE,$SPG $O $REG $SPY
SNSE,Sensei Biotherapeutics Inc. Common Stock,14.42,-0.11,-0.01,Medium,United States,138066,Health Care,1990911.72,TRUE,$950160.KQ $ABBV $AMGN $SPY
GERN,Geron Corporation Common Stock,1.62,0.04,0.03,Medium,United States,1226116,Health Care,1986307.92,TRUE,$950160.KQ $ABBV $AMGN $SPY
BBSI,Barrett Business Services Inc. Common Stock,71.3,2.44,0.04,Medium,United States,27824,Technology,1983851.2,TRUE,$RHI $UPWK $MAN $SPY
OBNK,Origin Bancorp Inc. Common Stock,43,0.59,0.01,Medium,United States,45516,Finance,1957188,TRUE,$TFC $PNC $FRC $SPY
EVLO,Evelo Biosciences Inc. Common Stock,10.61,-0.09,-0.01,Medium,United States,183762,Health Care,1949714.82,TRUE,$950160.KQ $ABBV $AMGN $SPY
WTTR,Select Energy Services Inc. Class A Common Stock,5.21,0.23,0.05,Medium,United States,373973,Energy,1948399.33,TRUE,$SLB $BKR $HAL $SPY
MERC,Mercer International Inc. Common Stock,14.62,0.23,0.02,Medium,Canada,133172,Basic Industries,1946974.64,TRUE,$MERC $RFP $CFX.TO $SPY
ARLP,Alliance Resource Partners L.P. Common Units representing Limited Partners Interests,5.88,0.08,0.01,Medium,United States,330674,Energy,1944363.12,TRUE,$EVA $EFR.TO $ARLP $SPY
HMPT,Home Point Capital Inc Common Stock,9.7,0.4,0.04,Medium,United States,200226,Finance,1942192.2,TRUE,$RKT $PCSO $UWMC $SPY
CTSO,Cytosorbents Corporation Common Stock,8.8,0.12,0.01,Medium,United States,220402,Health Care,1939537.6,TRUE,$ABT $DHR $SYK $SPY
ANGN,Angion Biomedica Corp. Common Stock,17.83,-0.24,-0.01,Medium,United States,108342,Health Care,1931737.86,TRUE,$JNJ $PFE $MRK $SPY
TK,Teekay Corporation Common Stock,3.3,0.1,0.03,Medium,Bermuda,583575,Transportation,1925797.5,TRUE,$ENB.TO $TRP.TO $PPL.TO $SPY
BLU,BELLUS Health Inc. Common Shares,3.93,0.09,0.02,Medium,Canada,489352,Health Care,1923153.36,FALSE,$AUP.TO $ZYME $TRIL.TO $SPY
EBSB,Meridian Bancorp Inc. Common Stock,18.64,0.22,0.01,Medium,United States,103012,Finance,1920143.68,TRUE,$RKT $PCSO $UWMC $SPY
CAC,Camden National Corporation Common Stock,48.03,0.17,0,Medium,United States,39877,Finance,1915292.31,TRUE,$TFC $PNC $FRC $SPY
TDW,Tidewater Inc. Common Stock,13,0.47,0.04,Medium,United States,147205,Consumer Services,1913665,TRUE,$SLB $BKR $HAL $SPY
CDZI,CADIZ Inc. Common Stock,9.62,0.03,0,Medium,United States,197989,Public Utilities,1904654.18,TRUE,$AWK $WTRG $CWT $SPY
LSF,Laird Superfood Inc. Common Stock,37.67,0.2,0.01,Medium,,50361,Consumer Non-Durables,1897098.87,TRUE,$MDLZ $KHC $GIS $SPY
AEYE,AudioEye Inc. Common Stock,28.55,0.61,0.02,Medium,United States,66404,Technology,1895834.2,TRUE,$ADBE $CRM $INTU $SPY
FORR,Forrester Research Inc. Common Stock,43.3,0.82,0.02,Medium,United States,43589,Consumer Services,1887403.7,TRUE,$950140.KQ $CSGP $VRSK $SPY
GRC,Gorman-Rupp Company (The) Common Stock,33.53,0.42,0.01,Medium,United States,56284,Capital Goods,1887202.52,TRUE,$ITW $PH $SWK $SPY
CAMP,CalAmp Corp. Common Stock,11.13,0.28,0.03,Medium,United States,169288,Technology,1884175.44,TRUE,$CSCO $MSI $ANET $SPY
UVE,UNIVERSAL INSURANCE HOLDINGS INC Common Stock,14.47,0.13,0.01,Medium,United States,129676,Finance,1876411.72,TRUE,$PGR $TRV $ALL $SPY
MGTA,Magenta Therapeutics Inc. Common Stock,12.84,1,0.08,Medium,United States,146088,Health Care,1875769.92,TRUE,$950160.KQ $ABBV $AMGN $SPY
TWND,Tailwind Acquisition Corp. Class A Common Stock,10.1,0.18,0.02,Medium,,185711,Finance,1875681.1,TRUE,$SPY $DIA $IWM $QQQ
AGC,Altimeter Growth Corp. Class A Ordinary Shares,11.95,0.25,0.02,Medium,United States,156766,Finance,1873353.7,FALSE,$SPY $DIA $IWM $QQQ
BQ,Boqii Holding Limited American Depositary Shares representing Class A Ordinary Shares,5.97,0.4,0.07,Medium,,313205,Consumer Services,1869833.85,TRUE,$3690.HK $9618.HK $BABA $SPY
CERE,Cerevel Therapeutics Holdings Inc. Common Stock,13.15,-0.58,-0.04,Medium,United States,141133,Health Care,1855898.95,TRUE,$950160.KQ $ABBV $AMGN $SPY
SENEA,Seneca Foods Corp. Class A Common Stock,47.67,0.58,0.01,Medium,United States,38485,Consumer Non-Durables,1834579.95,TRUE,$MDLZ $KHC $GIS $SPY
GLAD,Gladstone Capital Corporation Common Stock,10.17,0.25,0.03,Medium,United States,179960,Consumer Non-Durables,1830193.2,TRUE,$BLK $BX $KKR $SPY
DXPE,DXP Enterprises Inc. Common Stock,30.49,0.32,0.01,Medium,United States,59854,Capital Goods,1824948.46,TRUE,$FAST $URI $GWW $SPY
TUFN,Tufin Software Technologies Ltd. Ordinary Shares,10.64,0.14,0.01,Medium,,171398,Technology,1823674.72,TRUE,$CHKP $CYBR $ALLT $SPY
CURO,CURO Group Holdings Corp. Common Stock,14.65,0.06,0,Medium,,124137,Finance,1818607.05,TRUE,$AXP $COF $DFS $SPY
MRNS,Marinus Pharmaceuticals Inc. Common Stock,15.5,0.02,0,Medium,United States,117159,Health Care,1815964.5,FALSE,$JNJ $PFE $MRK $SPY
BTNB,Bridgetown 2 Holdings Limited Class A Ordinary Shares,10.3,0.06,0.01,Medium,China,176224,Finance,1815107.2,TRUE,$SPY $DIA $IWM $QQQ
KE,Kimball Electronics Inc. Common Stock,25.92,0.12,0,Medium,United States,69988,Technology,1814088.96,TRUE,$IPGP $JBL $SANM $SPY
CDAK,Codiak BioSciences Inc. Common Stock,14.55,-0.53,-0.04,Medium,United States,124441,Health Care,1810616.55,TRUE,$950160.KQ $ABBV $AMGN $SPY
ATRS,Antares Pharma Inc. Common Stock,4.13,0.02,0,Medium,United States,438141,Health Care,1809522.33,TRUE,$950130.KQ $ALGN $WST $SPY
XPOA,DPCM Capital Inc. Class A Common Stock,9.95,0.09,0.01,Medium,United States,181641,Finance,1807327.95,TRUE,$SPY $DIA $IWM $QQQ
APLT,Applied Therapeutics Inc. Common Stock,18.21,-0.55,-0.03,Medium,United States,99001,Health Care,1802808.21,TRUE,$950160.KQ $ABBV $AMGN $SPY
CRSA,Crescent Acquisition Corp Class A Common Stock,10.06,0,0,Medium,United States,179149,Consumer Services,1802238.94,TRUE,$SPY $DIA $IWM $QQQ
CCNE,CNB Financial Corporation Common Stock,24.7,0.09,0,Medium,United States,72772,Finance,1797468.4,TRUE,$TFC $PNC $FRC $SPY
CIVB,Civista Bancshares Inc. Common Stock,23.15,0.21,0.01,Medium,United States,77625,Finance,1797018.75,TRUE,$TFC $PNC $FRC $SPY
DMS,Digital Media Solutions Inc. Class A Ordinary Shares,12.73,0.49,0.04,Medium,United States,140951,Miscellaneous,1794306.23,TRUE,$OMC $IPG $ADV $SPY
KRO,Kronos Worldwide Inc Common Stock,15.44,0.14,0.01,Medium,United States,115883,Basic Industries,1789233.52,TRUE,$DOW $WLK $OLN $SPY
NSCO,Nesco Holdings Inc. Common Stock,9.35,0,0,Medium,Cayman Islands,191093,Technology,1786719.55,TRUE,$FAST $URI $GWW $SPY
BLW,Blackrock Limited Duration Income Trust,16.74,-0.01,0,Medium,United States,106221,Finance,1778139.54,TRUE,$SPY $DIA $IWM $QQQ
VSEC,VSE Corporation Common Stock,40.4,0.9,0.02,Medium,United States,43992,Consumer Services,1777276.8,TRUE,$CTAS $CPRT $IAA $SPY
IBCP,Independent Bank Corporation Common Stock,23.76,0.12,0.01,Medium,United States,74530,Finance,1770832.8,TRUE,$TFC $PNC $FRC $SPY
CEIX,CONSOL Energy Inc. Common Stock ,9.55,-0.17,-0.02,Medium,,184030,Energy,1757486.5,TRUE,$EVA $EFR.TO $ARLP $SPY
EBF,Ennis Inc. Common Stock,21.43,0.08,0,Medium,United States,81533,Consumer Services,1747252.19,TRUE,$BRC $BEEN $DLX $SPY
VTOL,Bristow Group Inc. Common Stock,26.65,0.77,0.03,Medium,United States,65407,Transportation,1743096.55,TRUE,$SLB $BKR $HAL $SPY
CLBK,Columbia Financial Inc. Common Stock,17.59,0.11,0.01,Medium,United States,99077,Finance,1742764.43,TRUE,$RKT $PCSO $UWMC $SPY
UFCS,United Fire Group Inc. Common Stock,35.07,0.27,0.01,Medium,United States,49551,Finance,1737753.57,TRUE,$PGR $TRV $ALL $SPY
HOOK,HOOKIPA Pharma Inc. Common Stock,13.76,0.31,0.02,Medium,United States,125873,Health Care,1732012.48,TRUE,$950160.KQ $ABBV $AMGN $SPY
CUE,Cue Biopharma Inc. Common Stock,12.3,0.1,0.01,Medium,United States,140051,Health Care,1722627.3,TRUE,$950160.KQ $ABBV $AMGN $SPY
FPAC,Far Peak Acquisition Corporation Class A Ordinary Shares,9.87,0.1,0.01,Medium,,173976,Finance,1717143.12,TRUE,$SPY $DIA $IWM $QQQ
SYX,Systemax Inc. Common Stock,42.27,1.15,0.03,Medium,United States,40423,Capital Goods,1708680.21,TRUE,$FAST $URI $GWW $SPY
AMOT,Allied Motion Technologies Inc.,52.28,0.95,0.02,Medium,United States,32598,Capital Goods,1704223.44,TRUE,$EMR $3665.TW $ROK $SPY
SIFY,Sify Technologies Limited American Depositary Shares,3.6,0.07,0.02,Medium,India,473031,Technology,1702911.6,TRUE,$RAILTEL.NS $SIFY $532354.BO $SPY
THR,Thermon Group Holdings Inc. Common Stock,19.34,-0.15,-0.01,Medium,United States,87932,Energy,1700604.88,TRUE,$EMR $3665.TW $ROK $SPY
UFI,Unifi Inc. New Common Stock,27.51,-0.05,0,Medium,United States,61800,Consumer Non-Durables,1700118,TRUE,$UFI $CULP $CRWS $SPY
FFG,FBL Financial Group Inc. Common Stock,56.04,0.12,0,Medium,United States,30034,Finance,1683105.36,TRUE,$MET $PRU $AFL $SPY
KLDO,Kaleido Biosciences Inc. Common Stock,8.7,0.6,0.07,Medium,United States,193156,Health Care,1680457.2,TRUE,$JNJ $PFE $MRK $SPY
OTLK,Outlook Therapeutics Inc. Common Stock,2.21,-0.04,-0.02,Medium,United States,759393,Health Care,1678258.53,FALSE,$950160.KQ $ABBV $AMGN $SPY
KVSB,Khosla Ventures Acquisition Co. II Class A Common Stock,10.12,0.04,0,Medium,United States,165834,Finance,1678240.08,TRUE,$SPY $DIA $IWM $QQQ
UEIC,Universal Electronics Inc. Common Stock,56,1.03,0.02,Medium,United States,29870,Consumer Non-Durables,1672720,TRUE,$SONO $GPRO $VUZI $SPY
IMNM,Immunome Inc. Common Stock,32.33,-1.55,-0.05,Medium,United States,51549,Health Care,1666579.17,FALSE,$950160.KQ $ABBV $AMGN $SPY
SWBK,Switchback II Corporation Class A Ordinary Shares,9.95,0.12,0.01,Medium,,167394,Finance,1665570.3,TRUE,$SPY $DIA $IWM $QQQ
